title,subreddit,selftext,id,domain,url,is_self
"Surprise, surprise, Vancouver: Huawei CFO Sabrina Meng Wanzhou is a mansion-owning, satellite-parenting reverse immigrant",canada,,a4ppwj,sc.mp,,False
New bill could lessen tax woes for Canadians with U.S. citizenship,canada,[deleted],a8uv6d,cbc.ca,,False
The House: Justin Trudeau confronts the provincial uprisings,canada,,a4e8lr,cbc.ca,,False
5 Ways I’m Simplifying Christmas This Year To Actually Enjoy The Season | CBC,canada,,a3fcpi,cbc.ca,,False
"Meet Elon Muskox, the Yellowknife sculpture named after Tesla CEO",canada,[deleted],a8f068,cbc.ca,,False
"As Quebec's inquiry into Indigenous relations enters final phase, many question SQ's desire for reconciliation",canada,,a7fuwy,cbc.ca,,False
Out in the cold: “It’s clear that no one has Canada’s back.”,canada,[deleted],a7zvcr,cbc.ca,,False
"Bomb threats reported in cities across Canada, U.S.",canada,,a60dsy,cbc.ca,,False
Robert Steven Wright charged with 1st degree murder in connection with Renee Sweeney homicide,canada,,a5bhyq,cbc.ca,,False
"20 years after coming out, Mark Tewksbury reflects on life as a gay Olympian",canada,,a6uteu,cbc.ca,,False
Canada to deliver cargo plane part time for UN missions in new year,canada,,a93jwe,cbc.ca,,False
Huawei exec's arrest halting Chinese firms' Canadian expansion plans,canada,[deleted],a75dg4,cbc.ca,,False
Heritage status sought for original Africville home,canada,,a3ss35,cbc.ca,,False
Community throws holiday party for displaced residents of 650 Parliament Street,canada,[deleted],a72evq,cbc.ca,,False
'I don't want to die alone in an alley': Toronto overdose prevention site offers sanctuary for users,canada,,a7azab,cbc.ca,,False
Man raped by inmates during 'scared straight' prison tour awarded $175K from B.C. | CBC News,canada,,a3uy0e,cbc.ca,,False
Nova Scotia looks to keep redfish quota as other provinces want in,canada,,a63xww,cbc.ca,,False
The beginning and the end of the 'Stanley Cup caper' of 1970,canada,,a3k71a,cbc.ca,,False
Does anybody have any new information on the IED blast in May at the Indian restaurant in Mississauga?,canada,[deleted],ab00yj,cbc.ca,,False
School trustee candidate who claimed to be victim of racist death threats pleads guilty to elections fraud | CBC News,canada,,a85vnb,cbc.ca,,False
Saw this on CBC news tonight. How does the cameraman disappear? Skip to 19:00 and watch the guy carrying the camera just disappear as he walks from left to right. There must be a logical explanation.,canada,,a5d8c9,cbc.ca,,False
Huawei's CFO to be freed on $10M bail pending extradition to U.S,canada,[deleted],a5c8se,cbc.ca,,False
"$600M class-action lawsuit claims police mistreatment in N.W.T., Yukon and Nunavut",canada,,a7rezv,cbc.ca,,False
US standing up for us?,canada,[deleted],a68k84,cbc.ca,,False
'We belong here now': Northern B.C.'s first Syrian refugee family looks back on 3 years in Prince George,canada,[deleted],a7jv8z,cbc.ca,,False
"Amid a year of record violence, shooting survivors struggle to rebuild their lives",canada,,aapisg,cbc.ca,,False
From Ottawa to Nairobi: How a Canadian coach helped Kenyan hockey team roar | CBC Sports,canada,,a4h3sy,cbc.ca,,False
"RCMP crossed line while interrogating radicalized teen after 2014 terror attack, says Quebec Appeals Court",canada,,a2je46,cbc.ca,,False
Real versus fake Christmas trees: Which one's greener?,canada,,a3yn8g,cbc.ca,,False
"Don't use rapid tests to rule out strep throat, many pharmacists directed | CBC News",canada,,a2zlvw,cbc.ca,,False
Ottawa to announce boost for battered energy sector,canada,[deleted],a78h6w,cbc.ca,,False
"'I hope they can hear us in Ottawa': 1,500 attend Alberta oilpatch rally",canada,[deleted],a70xq5,cbc.ca,,False
"Potential oil development on Anticosti Island, Quebec...",canada,[deleted],a5ocqg,cbc.ca,,False
'Their stories must not be forgotten': Viens Commission closes with plea for Val-d'Or women,canada,,a6i6fd,cbc.ca,,False
School trustee candidate who claimed to be victim of racist death threats pleads guilty to elections fraud,canada,,a82xd7,cbc.ca,,False
Pride Toronto members demand leaders resign over deal to let uniformed police officers in parade,canada,,a3rlxs,cbc.ca,,False
Judge denies Omar Khadr's request for eased bail conditions,canada,[deleted],a8df37,cbc.ca,,False
Why cutting oil production seems so utterly un-Albertan | CBC News,canada,,a2zkd8,cbc.ca,,False
"Years ago, Canada and the U.S. came together to end the acid rain threat. What changed? | CBC News",canada,,a3nkrz,cbc.ca,,False
Great-West Life shuts down after threats to Winnipeg buildings,canada,,a3nzex,cbc.ca,,False
Trudeau's neglect of the nation has led us to this place,canada,[deleted],a4frvc,cbc.ca,,False
"Amid oil price crisis, major energy producer says Canada's largest pipeline system is 'dysfunctional'",canada,,a3mpw4,cbc.ca,,False
Bye-bye buck a beer? Just 1 company left selling $1 bottles,canada,[deleted],a7fksu,cbc.ca,,False
"There are more than 130 words and phrases on the Let's Speak Inuktitut project, or UKâlalautta Inuttitut, has recorded and published on SoundCloud. The Inuktitut language in Labrador is starting to almost disappear",canada,[deleted],a9msq2,cbc.ca,,False
"In the quest to build a better battery, a Canadian is energizing the field",canada,[deleted],a64a33,cbc.ca,,False
Q&A: The case for more Alberta refineries,canada,,a5siyx,cbc.ca,,False
Adapted transportation service in Quebec City in chaos following cyber-attack,canada,[deleted],a5uyvf,cbc.ca,,False
Government staffer named in Mark Norman document leak case suspended from job | CBC News,canada,[deleted],a3uc6a,cbc.ca,,False
Jagmeet Singh rejects his own MP's call to halt extradition of Huawei executive to U.S.,canada,,a84u3j,cbc.ca,,False
Cannabis producer Aphria fights back against short seller — but it's not enough to stop the stock slide,canada,[deleted],a334xl,cbc.ca,,False
George H.W. Bush dead at 94,canada,[deleted],a213l1,cbc.ca,,False
China sheds little light on detention of Canadian Michael Kovrig,canada,,a5hul6,cbc.ca,,False
Stop the clock: Curlers sound off on new timing system,canada,,a5t8o0,cbc.ca,,False
"PNP statements weren't true and minister should have known, says opposition",canada,,a26fxl,cbc.ca,,False
Sexual assault trial of former Canadian gymnastics coach resumes Thursday,canada,,a5sifc,cbc.ca,,False
"Social assistance costs ballooned under Liberals, auditor says in report",canada,,a3fsw9,cbc.ca,,False
Brightest comet of the year makes its closest approach to Earth on Sunday,canada,,a6vial,cbc.ca,,False
Teen found dead in The Pas was under CFS care,canada,[deleted],a6koet,cbc.ca,,False
"Some cauliflower, red and green lettuce sold in Canada recalled after U.S. investigation",canada,[deleted],a6vm78,cbc.ca,,False
RBC disputes report that it had access to users' Facebook messages,canada,[deleted],a7sz5j,cbc.ca,,False
How Thunder Bay police failed Indigenous people,canada,,a659s1,cbc.ca,,False
Sears pensioners hope to recoup their losses in $509M lawsuit | CBC News,canada,,a2zmfy,cbc.ca,,False
Cyber crooks increasingly targeting home devices: report | CBC News,canada,,a3ppp6,cbc.ca,,False
Gone Curling - 10 min long 1963 film,canada,,a5endo,nfb.ca,,False
NFB Ho Ho Holidays!,canada,,a9777n,nfb.ca,,False
FBI says it did NOT actually designate Proud Boys 'extremist group',canada,,a3us83,rt.com,,False
"Wishing someone ‘Merry Christmas’ worse than murder for Muslims, says Canadian cleric",canada,,aab2dr,rt.com,,False
Coupe Spengler: le Team Canada contraint Davos à défier Trinec,canada,,aajhau,rts.ch,,False
How Chinese hacking felled telecommunication giant Nortel,canada,,a5zizx,afr.com,,False
Huawei executive released on bail in Canada,canada,[deleted],a5c6e8,bbc.com,,False
Second Canadian 'missing' in China,canada,,a5r936,bbc.com,,False
US and China feud. Canada pays the price,canada,[deleted],a719aj,cnn.com,,False
Canada caught in the middle of US-China spat over Huawei executive,canada,[deleted],a77pmg,cnn.com,,False
Kotex tampons recalled after reports of pieces left in bodies,canada,[deleted],a5phxa,cnn.com,,False
Spotsir.in,canada,,a7v1vk,mix.com,,False
China tells Canada to release Huawei CFO Meng Wanzhou or face severe consequences,canada,[deleted],a4edmx,msn.com,,False
"Huawei arrest on Canada looks 'entirely political,' says American economist at Yale University",canada,,a6thxh,cnbc.com,,False
"Harm reduction worker charged after woman allegedly assaulted, injected with substance",canada,[deleted],a6q1bk,cp24.com,,False
On the Shore of Lake Ontario,canada,,aabpqk,etsy.com,,False
"Only one valid passport allowed, Hong Kong says after Huawei arrest",canada,,a5b7od,scmp.com,,False
Opinion: Global Warming and Grizzly Bears... Canada’s Neo-Liberal Hell,canada,,a7bp1f,sott.net,,False
xkcd: Mercator Projection,canada,,a45rc9,xkcd.com,,False
Hillarious SHUTUPSHAUN interview,canada,,a8mpd9,youtu.be,,False
Asking Asian Canadians the Best Things about Canada,canada,,aarfkd,youtu.be,,False
The Single Biggest Layoff in Canadian History - Rare Earth with Evan Hadfield,canada,,a26m29,youtu.be,,False
Is Canada even still a country?,canada,,a8wmin,youtu.be,,False
Canada on #10,canada,,aavqbo,youtu.be,,False
In case you missed it: How Americans are taught to think about Canadians,canada,,a1z58y,youtu.be,,False
"Canada's newest hip-hop podcast, The Shifters",canada,,a4e18o,youtu.be,,False
Globe And Mail- Video Statement Released by Raj Grewal,canada,[deleted],a7gsaj,youtu.be,,False
Civilization 6 is Properly Simulating Canadian Conditions,canada,,a60zdv,youtu.be,,False
OIL: Bullish or Bearish for the short term?,canada,,aauuhc,youtu.be,,False
Civilization VI: Gathering Storm - First Look: Canada,canada,,a58183,youtu.be,,False
Canada's Oldest Train Tunnel Reopened For One Day Special Christmas Event,canada,[deleted],a89873,youtu.be,,False
Comment s'habiller selon sa MORPHOLOGIE ?,canada,,a7e6z7,youtu.be,,False
Do you know Bob? (Merry Marimba Christmas from Edmonton!),canada,,a7t842,youtu.be,,False
"Place you must visit... Whirlpool Aero Car, Niagara Falls, Ontario, Canada.",canada,,a3t04s,youtu.be,,False
Have a Merry f@cking Trailer Boys Christmas Canada.,canada,[deleted],a997c6,youtu.be,,False
This Florida trailer park is taken over by French-Canadian retirees every winter | Snowbirds,canada,[deleted],a5m0ou,youtu.be,,False
Satirical take on “Baby it’s cold outside” controversy,canada,,a5a8st,youtu.be,,False
My Fingerstyle version of a Christmas classic ,canada,,a6gclq,youtu.be,,False
Most canadian fight ever. Caught on film,canada,,a4lm81,youtu.be,,False
The Khadr Tapes,canada,,a8h4ho,youtu.be,,False
Lumina Borealis At Fort Henry Kingston,canada,,a8kdpn,youtu.be,,False
Canada becomes a playable faction in Civ 6,canada,,a6gpsu,youtu.be,,False
A message from his Holiness to Canadians on Christmas Eve.,canada,[deleted],a99ese,youtu.be,,False
Retro Flashback Muchmusic Annual Christmas Tree Toss 1986-1999,canada,,aacpep,youtu.be,,False
Summer Vacation Day 3 : Time to Visit Santa's Home and Playground,canada,,a28q23,youtu.be,,False
Grab a tissue. West Jet 2018 Christmas Miracle.,canada,[deleted],a2cz7p,youtu.be,,False
"Merry Christmas, eh!",canada,,a951sk,youtu.be,,False
Sound and light show,canada,[deleted],a6gqo1,youtu.be,,False
Cut down my first tree!,canada,[deleted],aa3hvd,youtu.be,,False
A Truckers4Oil massive convoy from Nisku Alberta but who is watching? Trudeau's Agenda of Destroying Canada's #OiIIndustry is Proceeding as Planned Once Industry is destroyed then Canada canB bought by China&Soros for pennies on the $,canada,,a7tpxc,youtu.be,,False
Stripped axle on one flipped mine twice was just begin of ride two .,canada,,a82apu,youtu.be,,False
"Live coverage of the David Saint-Jacques launch, via NASA TV, starts at 5:30 a.m. EST. Could be Canada’s last Astronaut to fly with NASA. Watch Here",canada,,a2ktny,youtu.be,,False
Canadians Play a Scavenger Hunt in a Lecture Hall!,canada,,a9al7i,youtu.be,,False
tiny house tour on vancouver island!,canada,,a5ujtz,youtu.be,,False
Canadian Tire Money Truck Robbery Steals Almost $24: The Beaverton,canada,,a5wc3j,youtu.be,,False
"So yeah, I got teary eyed. I love when these come out each year. 2018 West Jet Christmas Miracle.",canada,[deleted],a2d1i2,youtu.be,,False
Crazy Canadian yelling in English at ordinary citizens of another country about their government. Truly sorry. Most of us aren’t like this.,canada,[deleted],a85729,youtu.be,,False
I’m a real Canadian now! ,canada,[deleted],aacwud,youtu.be,,False
The Legend of Maula Jutt. A thriller movie.,canada,[deleted],a9yzbm,youtu.be,,False
Happy New Years Canada !,canada,[deleted],ab6ebx,youtu.be,,False
“Hump me! F**k me! Daddy better make me choke. You better!” - hilarious,canada,[deleted],a4n4o0,youtu.be,,False
I'm indifferent about original title but heres some positivity from your gun owning neighbours,canada,,a5owix,youtu.be,,False
Study questions how parents' posts affect kids' future,canada,[deleted],a1zbmi,youtu.be,,False
5 winter tips to keep your car from freezing,canada,,a2up6e,youtu.be,,False
'I want my country back!' Angry Canadian loses it with BBC Host,canada,[deleted],a6iut2,youtu.be,,False
A Look Back at 2018 in Chillwack BC,canada,,aas2j3,youtu.be,,False
Collapse of Niagara Falls - 1954,canada,,aavxyv,youtu.be,,False
When Fred Penner met Mr Dressup,canada,[deleted],a9kgv3,youtu.be,,False
Who remembers the greatest fever dream of a Christmas special Canada ever produced? George and the Christman Star - 1985,canada,[deleted],a8f7x6,youtu.be,,False
Canada and energy.,canada,[deleted],a5pfd7,youtu.be,,False
What happens at an illegal border crossing,canada,[deleted],a3kphd,youtu.be,,False
A pristine winter sunrise on Salt Spring Island of the coast of Vancouver BC,canada,,a56o08,youtu.be,,False
Globe and Mail- Video Statement released by Raj Grewal,canada,[deleted],a7gsik,youtu.be,,False
Canadian cricket players asked to pay $2000 per player to represent Canada.,canada,,a7tskv,youtu.be,,False
Officer Red Flag and Internet Safety from Windsor Police Service,canada,,a3wpdt,youtu.be,,False
My parents are the reason why I got depression and almost committed suicide,canada,[deleted],a51ewi,youtu.be,,False
South Park: An American Winter in Canada,canada,[deleted],a26tvg,youtu.be,,False
"2015 Sirius XM Radio Interview of Canadian Astronaut Chris Hadfield by Comedians: Louis CK, Jim Norton, and Rich Vos - Hosted by Gregg (Opie) Hughes",canada,,a3ki7e,youtu.be,,False
Video Renderings of VIA Rail's New Trains for the Quebec City-Windsor Corridor,canada,,a5kfly,youtu.be,,False
Pro-Pipeline Rally blocking the Anthony Henday Drive in Edmonton.,canada,[deleted],a7srer,youtu.be,,False
J.J. McCullough: Bilingualism in Canada is a scam,canada,,a4ck9h,youtu.be,,False
Us state quiz,canada,,a9cnx2,youtu.be,,False
Icey and wet out riding the death machines with no brakes,canada,,a97iu3,youtu.be,,False
Only in Canada...,canada,,a8z6vl,youtu.be,,False
York Region PD impaired driving video,canada,[deleted],abaqu5,youtu.be,,False
Excellent speech on Trudeau's leadership,canada,,a4neqy,youtu.be,,False
University of Alberta vet nearly shoots himself in the finger when using carfentanil as animal tranquilizer,canada,,a77uhs,youtu.be,,False
I CUT DOWN MY FIRST TREE. Like a real Canadian!,canada,[deleted],a90d1v,youtu.be,,False
Wrote a pulpy alternate history novel deemed a “black metaphor for US actions in Iraq” by former Canadian-US Ambassador Michael Kergin. It’s about a Bush-era US military occupation of Canada. Free on Kindle if you’d like to take a gander.,canada,[deleted],a8b6gv,amazon.ca,,False
"Racism a risk to public health, says industry association",canada,,a7awzo,arada.org,,False
"Meet Mona Nemer, Canada’s top science adviser",canada,,a3hqg7,asbmb.org,,False
Michael Spavor: Second Canadian 'missing' in China,canada,[deleted],a5qzc2,bbc.co.uk,,False
"Canada deeply concerned by arbitrary detention of two Canadians in China. Statement issued by Chrystia Freeland, Minister of Foreign Affairs",canada,[deleted],a8f1zw,canada.ca,,False
‘A F—ING EXCELLENT IDEA’: Did Grover drop the f-bomb on Sesame Street?,canada,[deleted],aaqytv,canoe.com,,False
Miners find chicken-egg sized diamond in Canada's frozen north,canada,[deleted],a6h1oj,fin24.com,,False
[OC] Canada. Country portrait.,canada,,a4ff4m,i.redd.it,,False
This Canadian craft beer is designed like a No Name product,canada,,aahvya,i.redd.it,,False
-42°C w/windchill,canada,,ab9c41,i.redd.it,,False
Decisions Decisions...,canada,,a4251z,i.redd.it,,False
I got to meet Ed the Sock,canada,,a2wuzn,i.redd.it,,False
Beer Advent Calendar - Alberta Style,canada,[deleted],a231sr,i.redd.it,,False
Nice socks though,canada,[deleted],a2acrp,i.redd.it,,False
"For Christmas , Santa how more to go around",canada,[deleted],a7gzp4,i.redd.it,,False
"Oil and Gas Rally/Convoy in Grande Prairie, Alberta today.",canada,,a6uqyq,i.redd.it,,False
Health Canada: we have not received an application for AppleWatch EKG feature,canada,,a4w7x8,i.redd.it,,False
The cringe is real,canada,,a84x56,i.redd.it,,False
1974 CN TOWER,canada,,a4h6iu,i.redd.it,,False
"Canada, where politeness is a cover for being a grouch?",canada,,a7fgv9,i.redd.it,,False
Distant Angus Herd,canada,,a9w816,i.redd.it,,False
My Prime Minister with your Prime Minister (And the World Bank CEO in the middle),canada,,a36zut,i.redd.it,,False
Shop for Rugs Online Calgary | Shop Mattress Accessories Calgary,canada,,a9l0ka,i.redd.it,,False
Is it me or is Numeris asking to be a bit invasive?,canada,,a9q2ia,i.redd.it,,False
Fábrica de Subprodutos V,canada,,a7p4l2,i.redd.it,,False
Just more propaganda from Big Cave,canada,[deleted],a2vujv,i.redd.it,,False
Merry Christmas to you,canada,,a7zyzh,i.redd.it,,False
Tratamento de Resíduos Sólidos V,canada,,a3h6k9,i.redd.it,,False
Hey BBC. Can we please have our own category?,canada,[deleted],a8orfn,i.redd.it,,False
The OCS warehouse is strapped according to CBC London,canada,,a9q6qi,i.redd.it,,False
Blame Canada,canada,[deleted],a51z12,i.redd.it,,False
How is this not discrimination Service Canada?,canada,[deleted],a5juz2,i.redd.it,,False
Imagine hearing 'Don't Stop the Party by Pitbull' 14 times. Go Canada!,canada,,a9vlw6,i.redd.it,,False
Why Study in Canada?,canada,,a7veda,i.redd.it,,False
An only in Canada sign! Reality is...turn right at the Moose and they really are open.,canada,,a6lich,i.redd.it,,False
"Officer... we are in Canada... why would you pull us over for something so normal, in December, here?",canada,,a2fw6p,i.redd.it,,False
"I thought if any sub would take offense to my son's sweater, it would be this one.",canada,,ab89b2,i.redd.it,,False
Michael de Adder's cartoon from the Halifax Herald from last week.,canada,,a50w66,i.redd.it,,False
Baptisms in Canada be like...,canada,,a30g1t,i.redd.it,,False
It means Excuse me in slovakian.,canada,,aa0xm2,i.redd.it,,False
Hockey Night in Canada sponsored by..... Huawai!?!,canada,,a6l8f7,i.redd.it,,False
Efluentes Complexos V,canada,,a6afcg,i.redd.it,,False
"Spotted in Newfoundland! Oh, Canada!",canada,[deleted],aayk90,i.redd.it,,False
Yes.,canada,[deleted],abalbd,i.redd.it,,False
Not sure if this belongs here but people on my Facebook have been Resharing this liberal party post thinking it's an anti Trudeau meme,canada,,a5ise8,i.redd.it,,False
Someone got a Job and Someone got hurt.,canada,,aa14s7,i.redd.it,,False
The Canadian Cake.,canada,,a5xby5,i.redd.it,,False
Mother Nature being childish this winter playing games,canada,[deleted],aah8d1,i.redd.it,,False
Happy Boxing Day Canada!,canada,,a9owtk,i.redd.it,,False
PERITO em TRATAMENTO de ÁGUA V,canada,,a8ee4n,i.redd.it,,False
"More from the Badlands Snowy sunsets have been beautiful. [Crosspost from r/Lethbridge, credit u/clasualco]",canada,,a2yum4,i.redd.it,,False
So buying countries is a thing now,canada,,aa4wsb,i.redd.it,,False
"Saw this on Facebook. Canada, confirming what most of us already know.",canada,[deleted],a24130,i.redd.it,,False
"Canadians careful on what news you are watching. The CGTN America sounds like an American Television Broadcaster, but look closer even on youtube says it's 'Funded in whole or in part by the Chinese government. Propaganda much from the Chinese Government.",canada,[deleted],a6tpym,i.redd.it,,False
Patio door home security Eh?,canada,[deleted],a45b26,i.redd.it,,False
Wow this brings back memories...,canada,,a76osa,i.redd.it,,False
Just moved to Oh Canada. our water bill is way more than our electricity bill.,canada,,aa14e2,i.redd.it,,False
The Dutch town of Groesbreek honoured all the fallen Canadian soldiers that died fighting for Europe’s freedom on Christmas Eve. We are thankful for your service Canada.,canada,,a9c9xa,i.redd.it,,False
ICBC loves BC drivers,canada,,a9lqit,i.redd.it,,False
Where the REAL production comes from,canada,,a85cv4,i.redd.it,,False
An artist's rendition of confederation in its current state.,canada,[deleted],a5824l,i.redd.it,,False
Is this a joke?,canada,,a2vfwn,i.redd.it,,False
"My drive to Crankbrook, BC today",canada,,a2x45o,i.redd.it,,False
Buy Google Reviews,canada,,a8047a,i.redd.it,,False
Some shade with a side of good news,canada,[deleted],a3f18v,i.redd.it,,False
Did a spot of patriotic woodworking this week.,canada,[deleted],a5pd4r,i.redd.it,,False
Anyone else sick of these ads on every video?,canada,,a5iqs0,i.redd.it,,False
Sorry about that,canada,,a9x6zr,i.redd.it,,False
My mom got me this for Christmas. I thought it was really cool! Great quality. Definitely going to be my new item for a while. ✌️,canada,[deleted],a83sco,i.redd.it,,False
"Hmmm no that’s not right... Chris Hansen, maybe?",canada,,a2i3pk,i.redd.it,,False
Today I became a canadian!,canada,[deleted],aahrrs,i.redd.it,,False
,canada,,a4j581,i.redd.it,,False
The birth of a Canadian,canada,,a7z7c0,i.redd.it,,False
I told the federal government I wanted a free poster of Queen E^2 and they gave it to me. I love this goddamn country.,canada,,a8a6bn,i.redd.it,,False
My son loves this filter Christmas cutie,canada,,a9mj3j,i.redd.it,,False
"We elect officials to represent our interest, not the interest of other nations",canada,,a6yx3r,i.redd.it,,False
My Boring Company Not a Flamethrower arrived today... shamelessly showing off ,canada,,a744b4,i.redd.it,,False
fear our cobra chickens,canada,[deleted],a859oy,i.redd.it,,False
A cooler redesign of the Canadian flag,canada,,a1ytu9,i.redd.it,,False
Literally trying to outdo ourselves with the Monopoly money jokes.,canada,,a6gufj,i.redd.it,,False
I didn't know Lincoln was Canadian.,canada,[deleted],a4cs6n,i.redd.it,,False
Incredibly true.,canada,,a9az0y,i.redd.it,,False
After the protest in Edmonton,canada,,a7tzpl,i.redd.it,,False
Language review ,canada,,a5pfet,i.redd.it,,False
"This is Constable Nickel. Oddly enough, he only works the holiday season.",canada,,a5a257,i.redd.it,,False
Tried to Crosspost. Thought this cartoon from Halifax Herald cartoonist Michael de Adder would spark some interesting conversation in this sub. Stay civil!,canada,[deleted],a58ig1,i.redd.it,,False
"Stay in school, kids.",canada,,a45k1f,i.redd.it,,False
*shakes fist at Canada Post*,canada,,a343ld,i.redd.it,,False
Today I learned that Tim Horton's has a location in Madrid Spain... my friend did not know what the name means.,canada,,a9us9s,i.redd.it,,False
Hey! Canada Post.,canada,[deleted],a3fbza,i.redd.it,,False
Proud to be a Canadian ,canada,[deleted],a5yyfj,i.redd.it,,False
"Interesting phrasing there, No Frills!",canada,[deleted],a4wtpg,i.redd.it,,False
Tim Horton really needs to fix the coffee grind problem. ☕,canada,,a7cgme,i.redd.it,,False
Why does Service Canada discriminate against remarried immigrate fathers?,canada,,a5m1fu,i.redd.it,,False
Hhhmm...,canada,,a8r7oo,i.redd.it,,False
In Sask a GMC Terrain is a Collector ?,canada,,a8v8ah,i.redd.it,,False
#MediaBlackout /We are told of two incidents of kidnapping yet a huge list of anglo canadians charged for sexual abuse and pornography gets ignored by mass media.,canada,[deleted],a4a01i,i.redd.it,,False
 Tree decoration!!,canada,,a9cg38,i.redd.it,,False
Who Knew?,canada,,a2xlkh,i.redd.it,,False
Happy Boxing Day,canada,,a9rwgh,i.redd.it,,False
Spotted a chinook arch this evening. Very cool weather phenomenon in Southern Alberta.,canada,[deleted],a4smc1,i.redd.it,,False
"Ah yes, so festive",canada,,a2umhx,i.redd.it,,False
"Ya Ha Tinda, Alberta Canada",canada,,a9ap5h,i.redd.it,,False
"Toy Monster, a local creation by Sylvie Legendre and Magnus Vestli (highest viewed Canadian YouTube Channel)",canada,,a9cvps,i.redd.it,,False
[OC] Canada. Country portrait.,canada,,a4gegl,i.redd.it,,False
"It's that time of year again to give like Santa, and save like Scrooge. Vintage Canadian Tire.",canada,,a4gnh5,i.redd.it,,False
"The rockies at sunrise, Alberta",canada,,a41epn,i.redd.it,,False
"Quidi Vidi, Newfoundland 2017",canada,[deleted],aa7971,i.redd.it,,False
The truth guys,canada,,a3jynk,i.redd.it,,False
$1000/ month closet for rent in Vancouver!,canada,[deleted],a4ms1r,i.redd.it,,False
"Dear Tim Horton's FUCK YOU and your coffee grinds!! biggest mouthful of coffee grinds ever, I was almost sick.",canada,[deleted],a7c8lw,i.redd.it,,False
Trying to get one item delivered to Calgary via Amazon. Don't ship via Canada Post if you want any gifts to arrive before Christmas.,canada,[deleted],a5kl7m,i.redd.it,,False
"Truly Canadian-Found my husband, son and friend in Google Street View, playing hockey in our back alley!",canada,[deleted],aafeva,i.redd.it,,False
Help from New Zealand! (Your friendly overseas mates) Is anyone able to measure the height of this exact pet food bag,canada,[deleted],a6b2fj,i.redd.it,,False
NSFW Political Tailgate (from r/alberta),canada,,aahf0h,i.redd.it,,False
Moonlight so bright .....what do you think ?,canada,,a9qqcg,i.redd.it,,False
Making of a Lotr inspired map of Canada [GIF],canada,,a3y0ee,i.redd.it,,False
True Canadian Light Display,canada,,a9wzvl,i.redd.it,,False
