title,subreddit,selftext,id,domain,url,is_self
M.A.I.D. in Canada,canada,"For those who are unaware, M.A.I.D. stands for medical assistance in dying.  This legislation came into effect in June of 2016. I will be forever thankful to all of those who fought for this legislation. My mother died yesterday on her own terms. Not on the terms of the disease that was taking her body an inch at a time. For over thirty years my mother has been living with diffuse scleroderma. While many are able to live with scleroderma, my mothers was chipping away at her body and reducing her quality of life. Regardless, she persevered. In the last two years she started to lose more of the fights. Then the pneumonia set in. As her breathing deteriorated, she began to have panic attacks and nightmares. My mother didn't want to die. She had grandchildren she adores, family that loves her, and life she wanted to live. But this disease made that impossible. It stole basic bodily functions from her and was coming after her lungs. The doctors tried so hard to help her. To try and manage the issues to give her a decent quality of life. But her body didn't respond to the treatments, then it was too weak for most options. To further complicate treatment, she could not be given many of the normal pain medications as they caused more suffering and brought little relief. Even the last resort options were no longer working and a decision had to be made. Knowing that she would suffocate while fully aware, she chose M.A.I.D.. She chose to go on her own terms and not in terror, gasping for breath, being suffocated by her own body. I am so thankful my mother had this option. She spent her last days surrounded by her family. Surrounded by love. I got to tell her good bye. That I loved her. That I was proud she was my mother. I am so thankful my mother had this option. For those who are opposed to M.A.I.D., I do understand. This is not a choice for all and it was not easy to watch. But in your opposition of it, I ask that you please don't fight M.A.I.D. If you want this to end, fight the diseases that lead to people choosing M.A.I.D.. Support research looking for a cure for scleroderma, or cystic fibrosis, or ALS, or cancer. Fight for the end of these diseases that torture people in their own bodies. These are people who are dying already. My mother wouldn't not have lived much longer. But those last days would have been with great pain and suffering. Don't fight the option that lets people suffering these diseases find relief surrounded by their families and loved ones. I am so thankful my mother had this option. ",a4d7t5,self.canada,,True
Stupid question: Right to vote is contradiction?,canada,"(1982) Charter of Rights and Freedoms, Section 3: Every citizen of Canada has the right to vote in an election of members of the House of Commons or of a legislative assembly and to be qualified for membership therein. (2000) Canada Elections Act, section 3: Every person who is a Canadian citizen and is 18 years of age or older on polling day is qualified as an elector. I’m probably dumb, but can someone explain why the constitution gives everyone the right to vote and the Election Act doesn’t?",a7pxru,self.canada,,True
Canadian postal service??,canada,[deleted],a9xgbd,self.canada,,True
I have moved and I still have a library card from B.C. which Ican use to sign out ebooks. Can i still legally use that card?,canada,[removed],a8nx0d,self.canada,,True
The people of Ottawa need to learn escalator etiquette,canada,[removed],a4nvoc,self.canada,,True
"Canada, how does it feel to be America’s puppet?",canada,[removed],a6hvyd,self.canada,,True
Does anyone actually think Trudeau will stop the Huawei 5G rollout?,canada,"Honestly, I think it's delusional to think Trudeau will not let the Huawei deal through.  But my question is, is there anything that indicates he won't let the Huawei deal through? ",a3m5hx,self.canada,,True
Looking for Christmas Song Playlist from Canadian Elementary Schools,canada,"I loved the Christmas songs in Canadian elementary schools and give me great memories till today. now that I live in a country where Christmas is pretty much illegal, Saudi Arabia, I need a pick me up during this season. does anyone have a playlist of the exact Christmas songs we used to sing in elementary schools in the late '90s ",a6yl7f,self.canada,,True
I want to show off our country and I'm looking for some advice.,canada,"We live in a beautiful country full of diverse cultures, breathtaking landscapes, and unique traditions but I don't think we get as much attention as other countries and people always seem to be surprised when they see pictures of these things and find out they're in Canada. Over the course of 2019 I want to travel around Canada documenting the best parts of our country to help give us a little more recognition and while I can think of plenty of the more popular places to go I was wondering if there are some places you would recommend that most people don't know about or hidden treasures in your area. I appreciate any suggestions you guys are willing to give me.",a3rv3z,self.canada,,True
Huawei exec committed fraud by deceiving multiple banks: Crown (Vancouver Bail Hearing - 12/7/2018),canada,[removed],a465j5,self.canada,,True
Medication from Thailand to Toronto,canada,"So I bought some Tramadol (lower back pain)legally OTC from Boots Pharmacy in Thailand, but since a prescription is required for it in Canada, would it be okay to pack 10 pills or so in my check in bag?",a9f2lm,self.canada,,True
Sponsoring my boyfriend,canada,"Hey everyone! I have a couple questions regarding sponsorship. I \[F23\] am planning to sponsor my boyfriend \[22\] who is from France. He is currently living in Canada with a Working Holiday Visa of 2 years. I can't seem to find any information regarding traveling while the sponsorship process is taking place. Once we have submitted our papers and get an approval, are we both able to travel for long periods of time? Also, is it necessary to get a lawyer for this or is it possible to be successful while doing everything by yourself? Edit: We have been living together for 1 for 1 year which makes us common laws. ",a6wujr,self.canada,,True
"How a groundbreaking opioid tablet program will work in Vancouver, where overdoses have killed hundreds",canada,,a8pdwe,thestar.com,,False
Trudeau avoids confrontation with Saudi crown prince over Khashoggi killing at G20 summit,canada,,a25ii9,thestar.com,,False
More talk than action on increasing caribou protection: federal report,canada,,a8n5ho,vicnews.com,,False
"Transport Minister Marc Garneau (and 1st Canadian in Space) puts his support behind ‘Lunar Gateway’. Joining our participation of Canada with the U.S., Japan, Europe and Russia on the “Gateway to Mars”.",canada,,a3sb6y,lavalnews.ca,,False
The Most Canadian Car Thief Ever Returns Stolen Vehicle with Full Tank of Gas,canada,,a5ontf,dailyhive.com,,False
Canadian Imam: Saying 'Merry Christmas' Worse Than Murder,canada,,aa1wum,dailywire.com,,False
"Trudeau says he had ‘frank’ exchange with Saudi crown prince on Khashoggi, Yemen and human rights",canada,,a2bhze,globalnews.ca,,False
Indian nations ask Pope Francis to rescind Doctrine of Discovery,canada,,aaekcm,ncronline.org,,False
Canada's immigration minister Ahmed Hussen calls out Conservatives for 'spreading lies' about UN migration agreement,canada,,a6r5o9,news.vice.com,,False
'The values test is gone': Faith groups welcome changes to summer jobs attestation,canada,,a47h3t,nationalpost.com,,False
Canadian facing possible death penalty over drug smuggling in China could be pawn Huawei dispute: experts,canada,,aa5u5y,nationalpost.com,,False
"A handsome pilot, a cute dog and camping in northern Ontario how much more Canadian could this get?",canada,,a7ojtl,settingnorth.com,,False
Ford government to offer buyout packages to thousands of OPS employees,canada,,a5nw3z,toronto.ctvnews.ca,,False
"Statistics Canada suspends credit searches, delays plan to obtain banking records",canada,,a2nocj,theglobeandmail.com,,False
Globe editorial: The end of the Trudeau government’s China delusion,canada,,a6fhoy,theglobeandmail.com,,False
Report shows embarrassment in India was a comedy of Canadian errors,canada,,a2xzek,theglobeandmail.com,,False
Immigration fraud charges stayed against Charlottetown motel operators,canada,,a6cafv,thechronicleherald.ca,,False
Canada's Cannabis Crunch Is Bleeding Entrepreneurs Dry,canada,,a71aq8,thecannabiscomplex.com,,False
Huawei executive's arrest could impact Vancouver real estate prices,canada,,a5uhp5,vancouverisawesome.com,,False
"LNG Canada’s $40 billion project in Kitimat ‘at risk’ if steel anti dumping safeguards stay, Ottawa told | Financial Post",canada,,a83v0q,business.financialpost.com,,False
Philip Cross: The dirty secret behind Canada’s supposedly ‘successful’ public-sector pensions,canada,,a3ojsv,business.financialpost.com,,False
Canada and 5 other nations pull trigger on world’s biggest trade deal — leaving America out in the cold,canada,,ab9b1j,business.financialpost.com,,False
'FastPass' to Santa: Like a Nexus lane to the jolly old elf,canada,,a6rcqm,cbc.ca,,False
"'A huge class': McGill graduates 40 students from Indigenous language and literacy program. Certificate is one of several programs offered in Cree, Inuktitut, Mi'kmaq, Naskapi and Mohawk",canada,,a3lvnk,cbc.ca,,False
"Mounties mark historic day in union drive, but results still months away",canada,,a7wina,cbc.ca,,False
Two Laurier professors sue former TA who recorded disciplinary meeting,canada,,aao5iq,cbc.ca,,False
"More than 130 words and phrases on the Let's Speak Inuktitut project, or UKâlalautta Inuttitut, has recorded and published on SoundCloud. The Inuktitut language in Labrador is starting to almost disappear",canada,,a9msuo,cbc.ca,,False
"Thunder Bay police 'stopped seeing Indigenous people as humans,' says Anishinaabe podcast host",canada,,a6mlxo,cbc.ca,,False
"CSIS gathered info on anti-petroleum groups, but only in pursuit of threats: Watchdog",canada,,a7v20v,cbc.ca,,False
First Nations argue new hockey league is 'blatant racism' | CBC News,canada,,a8zvtl,cbc.ca,,False
U.S. joins Freeland in condemning 'arbitrary detention' of Canadians and calls for 'immediate release',canada,,a8er2r,cbc.ca,,False
"New Tim Hortons coffee lids leak too much, some customers say",canada,,a3mprv,cbc.ca,,False
Tragedies in Arctic hamlet sparking talk of a Franklin 'curse',canada,,a7aa33,cbc.ca,,False
1st Amish settlement west of Ontario prepares for Prairie winter in quiet Manitoba town,canada,,a4ulan,cbc.ca,,False
'We want to fill the place': Sydney call centre owner gets rock star welcome,canada,,a88zba,cbc.ca,,False
Acura asks vehicle owners to pay to diagnose possible defect,canada,,a7l7zt,cbc.ca,,False
York Regional Police say they will publish names of those charged with impaired driving,canada,,a32k41,cp24.com,,False
"Winter wonderland ❤❤❤❄ ~ Taken in Magnetawan, ON.",canada,,aarp0x,i.redd.it,,False
I hope everyone’s Boxing Day was as good as mine was enjoying this view of Mt. Rundle. Banff National Park.,canada,,a9vrvw,i.redd.it,,False
'Canada will pay': Chinese state media threaten repercussions over Huawei arrest,canada,,a5v2t6,ctvnews.ca,,False
Ex-astronaut Thirsk to help define Canada's place in Mars mission,canada,,aavy5j,ctvnews.ca,,False
"Santa Claus lives and pays taxes in Canada, government affirms",canada,,a98rnh,ctvnews.ca,,False
"If CBC Hadn’t Brought Back Baby It’s Cold Outside, I Probably Would Have Died",canada,,a5d7uv,medium.com,,False
Judge rules Unist'ot'en gate must come down for pipeline,canada,,a6itok,aptnnews.ca,,False
The Government Of Canada Is Now Officially Warning Canadians To Buy Legal Marijuana With Cash To Protect Their Personal Information,canada,,a7ixq5,mtlblog.com,,False
Super Cheap Data-Only Cell Phone Plans Are Finally Coming To Canada,canada,,a7axds,mtlblog.com,,False
"Huawei Executive Took Part in Sanctions Fraud, Prosecutors Say",canada,,a43wzl,nytimes.com,,False
"Canada added to Civilization 6. Prepare your armies of Mounties, declare war politely, and build those hockey rinks.",canada,,a5bg5k,pcgamer.com,,False
Trudeau effectively killed the oil patch when he made the pipeline approval process exponentially harder,canada,[removed],a2rgw0,self.canada,,True
Flu map/list,canada,"I’m looking for a map (or a list) that shows what flu strains are currently active in the country, preferably by province or region. Is there something like this out there? ",a9ssng,self.canada,,True
Some Best Buy workers needing to show up to work at midnight on Boxing Day,canada,[removed],a8b3yb,self.canada,,True
DOES A LONG PROCESSING TIME FOR A STUDY PERMIT MEANS A REJECTION?,canada,"Hey y'all, Note: I will not include application numbers or UCI for discretion and privacy reasons. I come from a wealthy family but have a shitty nationality. Disclaimer: I respect and obey laws of all countries. I agree upon the terms and conditions of Canada, CIC and the Canadian Embassies. I do not hate any Canadian governmental entity and 100% NOT promoting hatred towards any person or governmental authority of any nationality. I am sorry if this post tilts anyone. So basically I am applying for a study permit outside Canada from a country other than my shitty home country. The first time I applied was on the 26th of September 2018 (NO ADDITIONAL SUPPORTING DOCUMENTS PROVIDED, MANDATORY SUPPORTING DOCUMETS PROVIDED). This application was viewed/updated by CIC officer twice or more per week (I get notifications on email for that). Then It was rejected by the embassy on the 6th of November 2018 for various reasons such as no proof of returning back to homeland or country of residence other than Canada, not convincing purpose of travel and no ties to country of residence ( country you are applying from ) or home country. I read the refusal letter from embassy 3 times and it said: if you believe you have strong proofs that can change your permit situations and answer the misinterpretations we have please provide them in a new application if you wish. You are free to reapply at any time because there is no ban given to you. As of anyone with half decent data plan, I reapplied with a new application (that I included an additional document of letter of explanation of my current situations and additional proofs of ties and etc..) on the 12th of November 2018. Till now I didn't get any update/view from the CIC officer except one time on the 13th of November 2018. I think that the CIC officer is uninterested in my application and this brings me to the point that I may be rejected again which will leave a dark cloud in my logistics records for future visa applications for Canada or any other country ( I need a visa that is pain in the ass to get in order for me to travel to any country in the world. As well as result in a huge drama with my university after I have registered in 15 credit hours (registration list was sent to CIC in the second application) Travel/Visa Log: All of my past travels are legal and flawless. I think this is somehow critical Travelled to Georgia (Country) visa free and stayed for less than a month (underaged and 16 years old). Applied with my family for a US visitor visa (underaged and 14 years old) and was rejected for no proofs of return after travelling and was banned for 6 months and was allowed to reapply any time after 6 months. Tldr; I want (hopefully) human friendly legal advices on what to expect and what to do in case of an upcoming rejections. (University Education in my country of residence is shitty) Even a small comment is appreciated Thanks y'all ",a2tnxf,self.canada,,True
To Canadians: Is a wool great coat enough for winter?,canada,[deleted],a9cejo,self.canada,,True
Very specific Canadian border-related question,canada,"Let me preface this by saying this: I have never crossed a border into another country on my own before. So my experience in this area is zero. I've never had a passport to my name. I apologize in advance for poor wording. However, in the past year, I obtained a REAL ID Michigan license, (using my parents' address) the one that lets you traverse through the Canadian border and back. Unfortunately, in the same year, I also started attending college in Ohio and my parents also moved from Michigan to Ohio. My mom then had me change my postal address to her new Ohio one. So my question is: I have a REAL ID enhanced Michigan license, Michigan plate but Ohio address (I am a bit late to change it due to financial/work related obstacles up till now) Would I run into issues using my Michigan license to cross the Canadian border with the Ohio address on my 'file'? My apologies for the somewhat drawn out post. Just a question I had trouble finding an answer for myself on Google. Im also sorry if this isn't the subreddit to ask this LOL",a6udxg,self.canada,,True
"Release her, NOW",canada,[removed],a4oq33,self.canada,,True
Beware Bestbuy pushing open-box as new,canada,[removed],a7dw5m,self.canada,,True
Your Canada Post carrier's holiday gift,canada,[deleted],a409yh,self.canada,,True
How do Chinese migration react to Huawei affair,canada,[removed],a8xmbs,self.canada,,True
What is the history on plea bargaining?,canada,[removed],a9pmgv,self.canada,,True
[Map] How to get Alberta oil to the Chinese market,canada,[deleted],a8ee5s,self.canada,,True
have been in Toronto for 19 years now.,canada,[removed],a7pm2x,self.canada,,True
CBSA Holding package for 5 months,canada,[removed],a9rdo8,self.canada,,True
First Nations chiefs call for apology after Trudeau's 'patronizing' and 'sexist' comments on Trans Mountain,canada,First Nations chiefs call for apology after Trudeau's 'patronizing' and 'sexist' comments on Trans Mountain  Shared from Discover,a3vbtz,self.canada,,True
Deposit/Credit Check with Bell Canada Normal?,canada,Hey I was just wondering if a credit check or deposit with Bell Canada is normal when becoming a new customer? * I do not remember this being a part of the process. * They said it ranges between $200 and $500 but how do they come to this conclusion of the amount and why is it needed? * I was with Rogers before and I'm pretty sure I remember there being no credit check or deposit necessary. Thanks for any responses.,a68y7z,self.canada,,True
Grocery shopping in US,canada,Just wondering if anyone close to the border shops for groceries in the US. Is it a hassle bringing them back to Canada or is it worth it? Thanks.,a70o4y,self.canada,,True
When did Franco-Ontarians learn English?,canada,[deleted],a4gkg0,self.canada,,True
CRA Tax Refund Scam Etc Would you have a solution?,canada,"Hello, I'm pretty sure by now everyone at some point has heard of something close or known someone who has had these calls either robo or person from some 3rd world call center saying that their under investigation or that they are owed a refund or whatever in order for you to expose details to your bank or to scam you. I'm posting here because if this went on twitter it'd just die immediately because I'm not a celebrity, someone of influence, or someone that's attractive enough to hold attention (I'm average at best). So I choose Reddit to be my face because Reddit's the face of the internet (*runs around to get high fives). I was thinking about it for a while and I came up with two solutions and I was wondering if A. We could get enough attention on this that something might be done or B. We just keep bringing it up until those who can do something get frustrated enough to act. End goal is that I know we can't fully stop it as they will always find new ways but by putting up these obstacles we can keep them predictable and at the same time make it harder because it takes longer for them. My first proposed solution would be for the Personal Computer side. There is always going to be independent or remote software that isn't Vnc or Teamviewer that will be used. A law would take too long to be put in place and there's no guarantee, but for your bank to whip up a landing page to warn those who are gullible and have them interact or accept wouldn't take long. Obviously don't make it long just short to the point with a graphic of picture. Something in the lines of maybe 'This is a reminder to never give your bank passwords and to be mindful to log out of any remote access or assistance software and that the CRA does not do...' The weird thing is some of my banks have something like this, but its AFTER you login which is redundant. My second proposed solution for the phone calls is similar to the Computer one. I'm not sure if banks are willing to propose that their tellers leave a reminder at their counter but often times these are done through an ATM machine and we've seen those scotiabank or RBC ads about more of their products on the ATM screen. Why not have it there as well as a reminder but with a 5 second count down or something that forces them to wait or stop for a moment. Everyone that's 'in a rush' wouldn't stay for 2 minutes but its 5 seconds for that person to breathe as its an unavoidable obstacle. The intent would be (I'm in no way a psychologist) for them to have a break for a moment and to seed the thought that hey the CRA never does these types of calls only by mail, it could break their psychosis. Most of these scammers rely on pressure tactics that put their target into these panicked states, which means either they see it through or they break it momentarily long enough to come to their senses. At least that's from my perspective. I know CRTC previously cited that their enforcement is unable to trace these people but to keep public opinion they would display news headlines like 'Big bust in India as a joint CRTC and Indian police bust up a CRA scam operation...' They use dead numbers from Rogers/Bell but they are re-routed through something so all you would ever see is the dead number hence why they give you another number to call back to. They say it's difficult to trace, but I remember that one CBC investigation that located the call center in Pakistan very easily. I don't have the knowledge or experience of these experts or those who specialize in certain levels of investigations, psychology, tactics, etc therefore I ask you, the public of Reddit what are your thoughts and potential solutions?",aapv9o,self.canada,,True
Is there a subreddit for canadian packages?,canada,"I find the bilingual packets kinda charming, and I want to look at some more of them. Is there a subreddit dedicated to that kind of thing? stuff like  candy bar. ",a69p47,self.canada,,True
Any good resources on the history of Hudson's Bay Company?,canada,"I feel like the Wiki, along with other generic history resources are sanitized because HBC, unlike the British East India Company or VOC, still exists. Is there any good resources that document its existence comprehensively, both good and bad? And particularly what it was like living on HBC territory?",a8tu7g,self.canada,,True
"Tired of telus, recently bought a new phone in full, im free to go to whichever phone company i want, please give me some suggestions!",canada,[removed],a84x3o,self.canada,,True
Transferring from a US University to a Canadian University?,canada,[deleted],a3ye2m,self.canada,,True
I have received a warm job offer from a local (soon to be) legal marijuana dispensary in BC. How will this affect my travels to the USA?,canada,"Was getting a pizza from local establishment, and thought I would say hi to the local (soon to be) marijuana dispensary. Recently, they applied to get a license but was denied 4-3 by our local government. They're so confident that the next hearing, which is very soon, will give them the greenlight to operate as a legally regulated dispensary. Telling me this, led me to be asked for a job position. More of a 'come work for us, please. You would be a great addition.' Now, I'm a frequent border traveler. I enjoy paying 1.03/Liter of fuel in Blaine,WA and not getting ripped by the local pumps that can charge 1.30 and more. How will possibly working at this LEGAL dispensary affect my semi-montly travels to the USA? I know they usually ask current employment, as I have been many times. And I've also seen in the news if you are associated with marijuana production, investing or anything similar you are grounds to be lifetime banned. I'd like to add: I don't smoke marijuana regularly. I have not even consumed it in months but do believe it can work wonders for chronic pain. Thanks all.",a605n0,self.canada,,True
I need help from someone in Canada.,canada,[deleted],a31uj6,self.canada,,True
Canada Post has gotten worse since the strike ended,canada,"Anyone notice the post service has gotten worse since they have been forced to go back to work? I have gotten packages relatively at the same pace when there was rotating strikes, even one from outside of canada. Now I’m expecting one from montreal and have been for a week, it still hasn’t arrived! It literally says “Delayed due to labour disruption.” I’ve looked into this and saw a lot of people have the same issues and I get the feeling there is no real backlog this is being done on purpose. Any else having similar problems? ",a54pos,self.canada,,True
Doug Ford is Canadian politics’ rookie of the year | The Star,canada,,aa2xhv,thestar.com,,False
PC bait and switch on climate change punishes Ontario taxpayers to pay off polluters,canada,,a1ydpk,thestar.com,,False
Indian technology talent is flocking to Canada,canada,,a7zsoy,economist.com,,False
How George H.W. Bush and Brian Mulroney teamed up to curb acid rain,canada,,a3hge3,globalnews.ca,,False
The baby killed by Hamas is yet another wake-up call,canada,,a6g1mk,torontosun.com,,False
CRAIG: David Suzuki’s carbon footprint is immense,canada,,a6se02,torontosun.com,,False
