title,subreddit,selftext,id,domain,url,is_self
Sobeys Compensates Customer After Employee Admits Sexual Harassment,canada,,a78jnr,bchrt.bc.ca,,False
"CBC Joy To The World - My favourite radio day of the year with choral Christmas music from across Europe, tune in today! (Dec 23, 201)",canada,,a8vj47,cbcmusic.ca,,False
7-Year-Old Boy Calls 911 Because He Got Snow Pants for Christmas,canada,[deleted],aa8gjx,complex.com,,False
"Canada Post, anyone else having this sort of issue with parcels stuck in limbo?",canada,,a3o99b,i.imgur.com,,False
Canadian mouse.,canada,,a2a995,i.imgur.com,,False
U Sask History women make their demands,canada,,a861j4,i.imgur.com,,False
Brave Canadian farmer harvests the last potato (circa 2018),canada,[deleted],a2s9sd,i.imgur.com,,False
Oh Canada,canada,[deleted],a9ie53,i.imgur.com,,False
Walmart error.,canada,[deleted],a697tn,i.imgur.com,,False
Thank-you Andrew Scheer For The Beautiful Card,canada,[deleted],abc9cg,i.imgur.com,,False
Just noticed that Fido tries to get you to add a recurring payment when you get close to your data cap,canada,,a4y1jw,i.imgur.com,,False
"Attorney General Jeff Sessions Announces New Initiative to Combat Chinese Economic Espionage (November 1, 2018)",canada,[deleted],a5sg1q,justice.gov,,False
Pour une grève du zèle linguistique au fédéral,canada,,a8gzal,ledroit.com,,False
Our convoys will not stop until these two are out!,canada,,a7wjjn,m.imgur.com,,False
Daughter signing for her father at a Three Days Grace concert in Edmonton goes viral.,canada,[deleted],a6s19t,m.imgur.com,,False
Chief of Defence Staff Jonathan Vance on what China is doing to Canada,canada,[deleted],a31w6p,macleans.ca,,False
Will Conrad Black be pardoned by Donald Trump?,canada,,a63yri,macleans.ca,,False
Canada's 10 worst cities for hate crime,canada,,a5t2p7,macleans.ca,,False
"In Trudeauland, who makes all the decisions? - Macleans.ca",canada,,a5xr6q,macleans.ca,,False
Pikangikum First Nation marks historic connection to provincial electrical grid through Indigenous-led Wataynikaneyap Power project,canada,,a86bf2,newswire.ca,,False
"A former Canadian envoy was detained in China, less than a week after Canada announced Ms. Meng’s arrest",canada,,a5fun1,nytimes.com,,False
New Challenge as a Century of Automaking Ends,canada,,a2zmvf,nytimes.com,,False
Canadian court grants bail to CFO of China's Huawei,canada,,a5cnbv,reuters.com,,False
Brewer AB InBev partners with Tilray to tap cannabis drink market,canada,,a7v1rp,reuters.com,,False
ExxonMobil shelves Canada LNG export project,canada,,a81zgn,reuters.com,,False
Danish tax agency subpoenas Canadian pension fund over dividend tax refunds,canada,,a8faaw,reuters.com,,False
Canadian court grants bail to CFO of China's Huawei,canada,[deleted],a5cvjh,reuters.com,,False
"Canadian detained in China questioned daily, no lawyer access, not allowed to turn lights out at night: sources",canada,[deleted],a87cr5,reuters.com,,False
"An Air Canada flight was asked by Australian authorities to investigate an emergency beacon. The plane, with 270 people, flew at 4000 feet as crew and passengers used binoculars to locate a stranded sailor, who was later rescued by police. The flight landed safely in Sydney, 90 minutes delayed.",canada,[deleted],aa997q,rootuer.com,,False
"Northern neighbors, I would like to congratulate one of you!",canada,[deleted],aba9ud,self.canada,,True
Are we not allowed to talk about trudeau/UN migration compact?,canada,[removed],a2owy3,self.canada,,True
Nice hair but...Trudeau/Kennedy,canada,[removed],a8reyn,self.canada,,True
Moving to Canada,canada,[removed],a6ripj,self.canada,,True
Seeking some help on Tony Di Benedetto.,canada,[removed],a3em2s,self.canada,,True
"'Yes, anti-pipeline Vancouver really is North America’s largest exporter of coal'",canada,[deleted],a8pfkc,self.canada,,True
Help with termination package,canada,[removed],a86zln,self.canada,,True
You gotta love the Québécois wooden dancing man,canada,[removed],a8gs6h,self.canada,,True
DHL Express status said 'With delivery courier' but then postponed to tomorrow because they're backlogged. Do couriers just take packages with them so it looks like they're trying or will they actually try to deliver the next day?,canada,[removed],a5dy65,self.canada,,True
"Murder friend with hammer from behind. Manslaughter. 9 years, released early. Canadian justice blows again.",canada,[removed],a20vta,self.canada,,True
"Looking to move to Canada, and seeking informations",canada,[removed],a885l7,self.canada,,True
r/canada what's your plan for 2019?,canada,[removed],a9xz8q,self.canada,,True
Study,canada,[removed],a4wfh4,self.canada,,True
Athabasca university vs Queens university online,canada,[removed],a8q3w6,self.canada,,True
Horses inaugurate drive-thru at Carstairs Tim Hortons,canada,[removed],abch9g,self.canada,,True
Roblox,canada,[removed],a4qbak,self.canada,,True
World Juniors 2019,canada,[deleted],a9u3b8,self.canada,,True
CBC.ca: Quebec play about a man and his penis fined $500 over fake cigarette,canada,[removed],a68dd6,self.canada,,True
Grant programs,canada,[removed],a6d57y,self.canada,,True
Best way to get to kicking horse,canada,[removed],a7tzhq,self.canada,,True
Need help with Winter OE job locations?,canada,[removed],a2k9zd,self.canada,,True
Should Canada put refugees on an island?,canada,[removed],a3pntf,self.canada,,True
Hystar Raw Resin - Full bodied flavor true to the flower,canada,[removed],a4xrpk,self.canada,,True
Upvote/downvote,canada,[removed],aabmwd,self.canada,,True
Need Help,canada,[deleted],a9pcxe,self.canada,,True
B.C. couple convicted in legislature bomb plot freed by Appeal Court.,canada,[removed],a7p7wl,self.canada,,True
How long does it take for an RCMP investigation to conclude since the Bains/Grewal one is likely to begin momentarily?,canada,[removed],a2g6qh,self.canada,,True
"Sir John A. MacDonald, the first Prime Minister of Canada (1867–1873, 1878–1891), was a bit of a drunk. He was known to get belligerent at dinner parties, disappear on days-long benders and was repeatedly seen showing up to Parliament so blasted that he could barely even talk.",canada,[deleted],a88ksg,self.canada,,True
Provinces Equalization as % of Budget expenditures,canada,[deleted],a873pz,self.canada,,True
What to do if you fell for a scam? Help.,canada,[removed],a8d56v,self.canada,,True
I lost my wallet,canada,[removed],a2l547,self.canada,,True
Not sure if this is the place to post it but I needed some help with Canadian citizenship,canada,[removed],a8ow5e,self.canada,,True
notable event management programs?,canada,[deleted],a7pu41,self.canada,,True
How long does it take for an RCMP investigation to conclude since the Bains/Grewal one is likely to begin momentarily?,canada,[removed],a2giuh,self.canada,,True
"Chinese detentions raise fears of Canadian business chill, rethink of travel plans",canada,[removed],a62jcb,self.canada,,True
Children's entertainers Sharon and Bram owed thousands of dollars by B.C. promoter,canada, ,a7gwua,self.canada,,True
4 reason to visit New York City with friends and family.,canada,[removed],ab2r58,self.canada,,True
Oh I get it,canada,[deleted],a3rffd,self.canada,,True
U.S. Folks looking for Canadian Help,canada,[removed],a3h1ji,self.canada,,True
Why Are Foreign buyers allowed to buy up CANADIAN property have we been sold out by our own government,canada,[removed],a5p90b,self.canada,,True
Macbook prices in Canada,canada,[removed],ab8tvi,self.canada,,True
Validate Mexican college degree,canada,[deleted],a7qn3a,self.canada,,True
Western University,canada,[removed],a8bi0o,self.canada,,True
What do you think needs to be changed immediately in our country?,canada,[removed],a82u0w,self.canada,,True
National Survey for Canadians on English in Canada!,canada,[removed],a3fpne,self.canada,,True
Canada residency,canada,[deleted],a8zkw9,self.canada,,True
Can I download movies or is it forbidden ?,canada,[removed],a8cnd1,self.canada,,True
Say what you will about Brian Mulroney but his eulogy was exactly what was needed on many levels...,canada,[deleted],a3hkrj,self.canada,,True
Is tipping the mailperson common practise?,canada,[deleted],a5vfn1,self.canada,,True
Wake up,canada,[removed],aasqks,self.canada,,True
"With the new legal amendments (C-51) re consents prior to sex, what would be the most appropriate method of obtaining consent that could be retained for future accusations",canada,[removed],a74doh,self.canada,,True
New years resolution. Stop buying Chinese. Buy Canadian first and anywhere else you possibly can second.,canada,[removed],a9xogk,self.canada,,True
Italy: mobile 4G with 50GB limit for around 12CAD/month,canada,[removed],a69gq0,self.canada,,True
Sad and depression,canada,[removed],aatgew,self.canada,,True
Can anyone help this Texan with these Canada specific boots please?,canada,[removed],ab111c,self.canada,,True
Seneca CPA Program,canada,[removed],a3p3cl,self.canada,,True
Will Canada Post Be Able/Allowed to Resume Their Strike After the Holidays?,canada,"This is from a Global News article: The bill calls for the resumption of postal services and the imposition of a mediation process to resolve the dispute between the Crown corporation and CUPW. Since the mediation is imposed, does that mean “no more striking allowed, don’t worry, deal’s coming”, or do they have some way of resuming the strike at some point after the holiday season is over?",a53xsx,self.canada,,True
"Residents of or near London, Canada: what's this city like? Are there stereotypes of this area? Is it a nice place to live?",canada,[removed],a3eaas,self.canada,,True
Cheapest shipping options to anywhere BUT USA or Canada?,canada,"I've only now noticed that Canada Post doesn't have tracked shipping to anywhere besides USA and Canada, unless you want to pay an arm and a leg. I ship items that are the size of a small bar of soap; I use tiny bubble mailer envelopes. To USA this costs 13$ with Canada Post's Tracked Small Packet Air USA. However, for anywhere else in the world besides USA and Canada, if you want tracked then you're looking at 30-60$ shipping cost. Do any of you guys know how to ship small items with tracking internationally and not get ripped off?",a2jwn4,self.canada,,True
Did anyone else hear that really loud belch on the CBC morning news yesterday?,canada,[removed],a4pzn6,self.canada,,True
"My girlfriend, a Mexican national was told by the immigration office that they don't accept applications from Mexicans",canada,[removed],a5nme5,self.canada,,True
INTELCOM MONTREAL,canada,[removed],a57rfe,self.canada,,True
Jordan Peterson,canada,[removed],a7djld,self.canada,,True
Italy: mobile 4G with 50GB limit for around 12CAD/month,canada,[removed],a69czl,self.canada,,True
Real versus fake Christmas trees: Which one's greener? | CBC News,canada,[deleted],a998vr,self.canada,,True
12 days of christmas Cannabis style!,canada,[removed],a85904,self.canada,,True
"Signing 'The UN Migration Act' is a blatant act of TREASON by Justin Trudeau and the Liberals. Where is the outrage? Where is the turmoil in the streets? Privileged, ignorant, and selfish are but some of the words one can use to describe the modern Canadian electorate.",canada,[removed],a415q6,self.canada,,True
A Very Canadian Thing That No One Talks About,canada,[removed],a8cnwj,self.canada,,True
Rental Property Management Company in Canada,canada,[removed],a39nqx,self.canada,,True
Attending a Community College in Canada from the US,canada,[removed],a8ri3u,self.canada,,True
,canada,[removed],a3x4cc,self.canada,,True
Do you remember what your target for this year is?,canada,[removed],a3hfmh,self.canada,,True
Why does /r/canada have such a negative reputation on Reddit?,canada,[removed],a4bqx8,self.canada,,True
I created this channel to help students/professions who are planning to come to Canada for higher studies. The aim is to answer some of their doubts.,canada,[removed],a4pwib,self.canada,,True
Looking for Canadian Veterans/Anyone who has paid out-of-pocket for Essential Medical Services,canada,[removed],aa41ij,self.canada,,True
Which shops offer free shipping to the USA,canada,"So far just Simons, but any others?",aa5fot,self.canada,,True
Why isn't the JTF-2 intervening in China?,canada,[removed],a5u4yw,self.canada,,True
Merry Christmas and Happy Holidays!,canada,[removed],a8qvuv,self.canada,,True
Can I live on my own with just a HS diploma or GED?,canada,[deleted],a5lopc,self.canada,,True
Flex Credits from Work?,canada,"A company that I know of offers flex credits to their employees. I know you can use it for health and such but it's a new concept to me. I was told that flex credits depend on your salary and family situation, how exactly is the amount determined and is it worth negotiating with an employer? How many Flex Credits do you have from Work and how do you use yours? ",a9b7u6,self.canada,,True
"Any info on Dorjose consulting in Milton, ON?",canada,[removed],a2sq7o,self.canada,,True
Justin Trudeau is destroying Canada,canada,[removed],ab3q49,self.canada,,True
"Oh Canada,land of the free,till I stopped to pick up beer!",canada,,a43xwx,sudbury.com,,False
20 Year Old Murder Case of Renée Sweeney - Suspect in Custody,canada,,a5bicd,sudbury.com,,False
"Checking in? No thanks, I’m just here to use the Wi-Fi",canada,,aax9jz,thestar.com,,False
Books of names and a solemn ceremony honour Canada’s war dead on Parliament Hill,canada,,a7b5mf,thestar.com,,False
Investigations from TheStar - Royal College of Dental Surgeons of Ontario accused of Abusive Behaviour and Secrecy.,canada,[deleted],a9iqwv,thestar.com,,False
Justin Trudeau has lower approval and higher disapproval ratings than Donald Trump.,canada,[deleted],a8b3dj,twitter.com,,False
China's revenge against Canada 'will be far worse than detaining a Canadian',canada,,a5q7l7,twitter.com,,False
Cuphead [Online Game Code] is 25% OFF,canada,,a8m25x,twitter.com,,False
Someone has reported an active shooter at the Calgary Airport,canada,[deleted],a82kim,twitter.com,,False
Family in Kanata told they have to take their Outdoor Rink down because of a complaint from a neighbour that it is an 'eyesore'.,canada,,a6xml3,twitter.com,,False
"Bernier: Canada is about to sign the UN Global Compact on Migration, whose goal is to normalize mass migrations. No impact study, no debate. But Trudeau says we must have social and gender impact analysis when a project brings many male construction workers to a rural area?!!?",canada,,a252ul,twitter.com,,False
"Jennifer Keesmaat: When I was Chief Planner in Toronto, Mayor Ford approached staff and asked them to 'look the other way' when a family friend's business was caught dumping toxic chemicals into the river. Staff refused. Yesterday, Doug Ford's government made doing so legal. Beyond the pale.",canada,,a48bbl,twitter.com,,False
J.J. McCullough: Any Canadian pundit who responds to the Elizabeth Warren news with the conventional 'OMG AMERICAN PRESIDENTIAL CAMPAIGNS ARE SOOO LONG' take should remember that we've known Andrew Scheer is running for prime minister since September of 2016.,canada,,abbp45,twitter.com,,False
"Stephanie Carvin: 'At the end of the day #huawei Canada can say all it wants about the security of its networks, but if the Chinese state is literally taking hostages on the company's behalf, it doesn't really have a national security leg to stand on here.'",canada,,a8cfb1,twitter.com,,False
CPC Mp for fortsask on Twitter: References to 'Sikh extremism' or other 'extremisms' without context or evidence is an irresponsible way for the government to communicate about a sensitive issue. We would like more information about what led to that reference. #cdnpoli,canada,[deleted],a67dki,twitter.com,,False
' I'm in shock': theThe first 24 hours of the Saudi-Canada tweet feud left Canadians reeling,canada,,a6j0fd,usnews3.com,,False
2 people from the States visit Toronto. Definitely have to see more of Canada!,canada,,ab4qlu,youtube.com,,False
Canada's Medieval Theme for Civilization 6 - Vive la Canadienne O Canada,canada,[deleted],a6rwm1,youtube.com,,False
What they didn't tell you about Canadian weed Legalization,canada,,a32yva,youtube.com,,False
CESAR ROSA...Meu lugar...,canada,,a9yw78,youtube.com,,False
FEED EM FREEDOM 2! // Real news for real Americans (AND Canadians),canada,,a5vcyf,youtube.com,,False
Beautiful Aurora Borealis over Canadian Sky,canada,,aasq8b,youtube.com,,False
Canadian astronaut David Saint-Jacques wishes Merry Christmas from Space Station,canada,,a8eqfc,youtube.com,,False
"You guys are finally in a Civ game, and here's your theme!",canada,,a6etck,youtube.com,,False
Yellow Vest Solidarity in Canada!,canada,,a6kqne,youtube.com,,False
"CBC News: Canada doing U.S. bidding in Huawei case, economist says(hope the mod will not censorship this.)",canada,,a6ssxz,youtube.com,,False
CESAR ROSA...The songs of Cesar Rosa...Jazz part 3,canada,,a3imf2,youtube.com,,False
Tod Gordo Reporting Live From NYC For The Canadian Department Of Tourism,canada,,a24hyp,youtube.com,,False
Prime Minister Justin Trudeau FULL INTERVIEW | The National,canada,[deleted],a4sln8,youtube.com,,False
"Places to Visit in Montreal, Canada",canada,,a7ptcq,youtube.com,,False
5 demons caught on camera scary videos in canada,canada,,a3gdhx,youtube.com,,False
Will Arnett Teaches You Canadian Slang | Vanity Fair,canada,,a8ppvk,youtube.com,,False
CESAR ROSA...Verão do Rio...(Remix),canada,,aao07p,youtube.com,,False
Leaving China might not be so easy!,canada,[deleted],a8hhfi,youtube.com,,False
China Threatens Canada Over Huawei Arrest | China Uncensored,canada,[deleted],a5q0mu,youtube.com,,False
CESAR ROSA...Museu do Amanhã...(O filme ),canada,,a6o206,youtube.com,,False
Ed the Sock interviews Kamloops mayor Ken Christian,canada,,a2x8qv,youtube.com,,False
Christmas Tree Song - Kids Song (Made in Canada),canada,[deleted],a8mo31,youtube.com,,False
CESAR ROSA...Séduisant...,canada,,a6e887,youtube.com,,False
Toronto thug punches man pushing wheelchair on Christmas day.,canada,[deleted],aas144,youtube.com,,False
CESAR ROSA...Meu lugar...,canada,,a9tbra,youtube.com,,False
CESAR ROSA...Verão do Rio...,canada,,a7zug3,youtube.com,,False
CESAR ROSA...Six men and jazz...,canada,,a3idib,youtube.com,,False
Chilliwack BC Learns To Drive 2018,canada,[deleted],abcccf,youtube.com,,False
Staying At The Worst Reviewed Motel In Red Deer,canada,,a38lxy,youtube.com,,False
Highest GOLD Producing Countries - 2018 |The Financial Street,canada,,aaxdgd,youtube.com,,False
CESAR ROSA...Pé no Campo...,canada,,a8odli,youtube.com,,False
Ambleside in 4K (UHD),canada,[deleted],a7rxdw,youtube.com,,False
What A 'Green New Deal' Means For Canada | w/ D.T. Cochrane,canada,,a72ykf,youtube.com,,False
"Canada doing U.S. bidding in Huawei case, economist says",canada,,a6in3g,youtube.com,,False
New biker gang with ties to Hells Angels crops up in Lower Mainland - Abbotsford News,canada,,a7qj9w,abbynews.com,,False
"Surprise, surprise, Vancouver: Huawei CFO Sabrina Meng Wanzhou is a mansion-owning, satellite-parenting reverse immigrant",canada,[deleted],a4shhp,amp.scmp.com,,False
Canadian tennis player Aleksandra Wozniak officially retires from competition,canada,,a7pcc5,cdntennis.ca,,False
Two drivers test positive for drugs in 24 hours – Antigonish,canada,,a51575,haligonia.ca,,False
"Qualifications lowered for OPP commissioner job, allowing Ford family friend to apply",canada,[deleted],a32sj1,ipolitics.ca,,False
Revue de l'année 2018 pour la francophonie torontoise,canada,,ab509o,l-express.ca,,False
"Federal Cabinet Ratings: A happy new year for Freeland; Hussen, Sohi face cold winter ahead - Angus Reid Institute",canada,,a6iciw,angusreid.org,,False
Canada’s Rig Count Plunges by More Than Half in Two Weeks,canada,,aas7tn,bloomberg.com,,False
Business Booms for Insolvency Trustees Amid Higher Canada Rates,canada,[deleted],a7ynls,bloomberg.com,,False
"Veteran Energy Analyst Retires, Saddened by Canadian Oil Policy",canada,,a4wzdn,bloomberg.com,,False
Justin Trudeau’s climate plans are stuck in Alberta’s tar sands,canada,,a5yifb,economist.com,,False
In Canada detained Huawei CFO and daughter of the founder of the company,canada,,a3ofbs,freenews.live,,False
"Former Guantanamo Bay detainee Omar Khadr wants Canadian passport to travel, permission to speak to sister",canada,[deleted],a519kv,globalnews.ca,,False
Andrea Montgomery: In defense of tipping,canada,,a2g780,globalnews.ca,,False
Hard hitting Canadian news from Burnaby,canada,,a5zlrw,globalnews.ca,,False
‘A very good experience for us’: students at Calgary Islamic School celebrate their culture,canada,[deleted],a8h57h,globalnews.ca,,False
Police say bomb threats across Calgary a hoax as authorities across North America investigate similar reports - Calgary | Globalnews.ca,canada,,a61o6k,globalnews.ca,,False
Police called to attempted break in at Vancouver property linked to Huawei CFO Meng Wanzhou,canada,,a4oh4d,globalnews.ca,,False
Exclusive: Police called to attempted break in at Vancouver property owned by Huawei CFO,canada,,a4rv0o,globalnews.ca,,False
"Omar Khadr wants Canadian passport to travel, permission to speak to sister",canada,,a57rwz,globalnews.ca,,False
"Omar Khadr wants a Canadian passport to go to Saudi Arabia and talk to his sister, who has spoken out in support of Al-Quaeda",canada,[deleted],a5u0lx,globalnews.ca,,False
"BC Ferries crew rescues boater from ‘90 km/h winds, massive waves’ near Moresby Island",canada,,a7r33v,globalnews.ca,,False
Scheer says Liberals redacted information in security report on Trudeau’s India trip,canada,,a31vix,globalnews.ca,,False
"Former Wilfrid Laurier TA Lindsay Shepherd, who released audio of meeting, sued by profs: lawyer",canada,,aaxdvh,globalnews.ca,,False
Windstorm destroys historic White Rock pier. Man rescued by helicopter - BC,canada,,a85n24,globalnews.ca,,False
It's illegal to pretend to be a witch in Canada,canada,[deleted],a592s8,i.kym-cdn.com,,False
PEI man fights climate change by not having kids,canada,[deleted],a8eh4z,instagram.com,,False
Canada’s the best when it comes to energy,canada,,a6clx6,m.youtube.com,,False
"2018 marked some big milestones in the North American natural gas market, ex. combined Canadian and U.S. natural gas production reached a record high in August, when production reached 101 Bcf/d",canada,,a7nlqa,neb-one.gc.ca,,False
The fight’s not over: Bill C-76 passes without protecting political party data | OpenMedia,canada,,a8evq5,openmedia.org,,False
Canadian Government Releases List of Federal Finance Recommendations via House of Commons,canada,,a5tb4u,ourcommons.ca,,False
Visa on Arrival in India for Canadian Citizens,canada,,a3br1f,tajtravel.com,,False
Bong protester found not guilty of charges laid at Cambridge hospital,canada,,a8ev6r,therecord.com,,False
"Atheist awarded $11,000 because they object to school acknowledging religion.",canada,[deleted],a81ehf,www-m.cnn.com,,False
Coming clean — Greater Fool – Authored by Garth Turner,canada,,a8bqih,greaterfool.ca,,False
"International Crisis Group Canadian adviser Michael Kovrig detained in China, NGO says",canada,[deleted],a56zue,hongkongfp.com,,False
"Sorry for this, i know this is not the right place but please help me i have no other option left please",canada,[deleted],a3hkq4,m.facebook.com,,False
SPCA and OPP let horses starve to death on Waterford farm,canada,,a257xr,m.facebook.com,,False
Québec imports Alberta salt,canada,,a5hy54,old.reddit.com,,False
Drug in the wedding .. Meghan Markle victim,canada,,aaaof3,thebeautik.com,,False
"‘Baby, It’s Cold Outside’ pulled from radio play for climate change denial",canada,[deleted],a78bvf,themanatee.net,,False
"White reservist who hurled racial abuse at black soldiers won’t be disciplined, army decides",canada,,a2jecm,theobserver.ca,,False
Cone of silence surrounds Danforth shooting,canada,[deleted],aabsus,torontosun.com,,False
A visit from the ghost of Ontario’s fiscal future,canada,,a7jsp4,torontosun.com,,False
Cone of silence surrounds Danforth shooting,canada,,aacwco,torontosun.com,,False
Cone of silence surrounds Danforth shooting,canada,[deleted],aa77pa,torontosun.com,,False
Omar Khadr pushes the limits of our generosity,canada,[deleted],a5oecw,torontosun.com,,False
Grants to students failed basic math,canada,[deleted],a408l8,torontosun.com,,False
Scapegoating Toronto Police,canada,,a8p19v,torontosun.com,,False
No place for lies in gender debate,canada,[deleted],a78lp4,torontosun.com,,False
"Ex-deputy education minister, jailed for child porn charges, out on parole",canada,,aay23b,torontosun.com,,False
Free speech policy mandatory on campuses in new year,canada,,aaxlna,torontosun.com,,False
"Despite our latitude, Walletwyse analysis shows the cost of food in Canada is significantly less than much of the United States (chart)",canada,,a2zfhr,walletwyse.com,,False
New laws and rules coming into effect in 2019,canada,,ab9n55,beta.ctvnews.ca,,False
"Bank of Canada finds that 58% of Canadians who own Bitcoin see it as an investment, and adoption is growing. Shakepay Change (just announced) will let Canadians round up their purchases to buy Bitcoin automatically.",canada,[deleted],a65u0j,get.shakepay.co,,False
Team Canada West wins bronze at 2018 World Junior A Challenge,canada,,a6wviz,hockeycanada.ca,,False
Threats to area schools continue for second day — Kingstonist,canada,,a3ru5l,kingstonist.com,,False
"CRTC's low-cost data-only plan decision is disappointing, 'slap in the face,' say advocates",canada,[deleted],a7zle2,mobilesyrup.com,,False
Ontario’s Bill 66 aims to scrap Wireless Services Agreements Act,canada,,a4269f,mobilesyrup.com,,False
ISED study confirms Canada has some of the highest wireless prices in the world,canada,[deleted],a8gww8,mobilesyrup.com,,False
Removing Huawei equipment could cost Canadian telecoms $1 billion,canada,[deleted],a4dja0,mobilesyrup.com,,False
