title,subreddit,selftext,id,domain,url,is_self
I need help ordering at Tim Hortons,canada,"So I am tired of getting messed up orders from Tim Hortons. I more than slightly expect that it is because I confuse the employee taking my order. Call me crazy, but I don't like cheese. So this is what I would like to order. 1 Croissant breakfast sandwich without cheese 1 Hashbrown 1 Medium coffee black How do I as a customer phrase that order to maximize my chances of receiving a correct order? ",a3etl2,self.canada,,True
"18 year old, wanting to move to Canada from London, UK",canada,[removed],a7mf5d,self.canada,,True
‘Hundreds’ of Canadians held by China raises the stakes for Trudeau’s government,canada,,a875cs,thestar.com,,False
Falling B.C. real estate market projected to bring national home sales down to nearly 10-year low,canada,,a7b8zi,globalnews.ca,,False
‘We have left it too late’: scientists say some B.C. endangered species can’t be saved,canada,,a4fbfu,thenarwhal.ca,,False
Emails contradict MP’s claims about when he was given confidential report on multimillion-dollar land deal,canada,,a51hzg,nationalpost.com,,False
Huawei CFO's Arrest Could Be Last Straw For Vancouver's Struggling Housing Market,canada,,a6cc2e,huffingtonpost.ca,,False
"McLauchlin: If you support English in Quebec, back French in Ontario",canada,,a23gxk,ottawacitizen.com,,False
"With less than a year to the election, no party holds a clear lead | Canada Market Research | Ontario | Campaign Research",canada,,a7h0i7,campaignresearch.ca,,False
"‘We’ve never been this alone’: Canada finds itself caught between two powers, without any ‘serious allies’",canada,,a65m6t,nationalpost.com,,False
"Chill out, folks; there's no need to be so defensive about Christmas",canada,,a9rrfs,cbc.ca,,False
Heating oil drains into Ottawa River after spill in downtown Gatineau,canada,,a8qt44,cbc.ca,,False
The road to gender equality should not be littered with empty wine bottles: Opinion | CBC News,canada,,a2q9ux,cbc.ca,,False
Anti-gay bullying at Newfoundland school like 'a civil war',canada,[deleted],a3dfh8,cbc.ca,,False
Seamus O'Regan draws scorn for comparing his career arc to veterans' struggles,canada,,a51714,cbc.ca,,False
Justin Trudeau to attend annual Polytechnique memorial in Montreal,canada,,a3r0b8,cbc.ca,,False
Feds considering increased risk level for travel to China,canada,,a5af5w,cp24.com,,False
This map that shows Timmins but leaves off Toronto,canada,,a81hp2,i.redd.it,,False
Potato shortage looms due to 'harvest from hell' after unseasonable weather,canada,,a2onad,ctvnews.ca,,False
What do Canadians wear? (Question from an American),canada,"I'm going to be visiting Victoria BC during Christmas. I was inspired by a  posted recently about CIA chief of disguise Jonna Mendez. She talks about how people vary in subtle ways from country to country. This makes me think I should try not to 'stick out' as an American tourist during my trip. Can anybody give me some tips about how to dress, or anything else I can do to blend in a little? Does anything immediately give someone away as an American? I'm mostly thinking about this for fun, although it can be practical not to attract too much attention.",a7s4oo,self.canada,,True
[serious] I want to drive to the Hudson Bay. Please advise. Have you done it?,canada,"Hi friends to the north, native Michigander here. I love rustic camping, long road trips, meeting new people, and exploring unusual places. I recently decided it would be fun to try and drive really far north, maybe to the Hudson Bay from Michigan. It’s not immediately obvious how this can be done, or how dangerous it is. Question 1: Route  seems to be a good starting place for my research. I likely can expect to encounter snow and dirt roads. Growing up in Michigan I drive to school in 6” of snow without issue, but I expect dirt roads may be a bigger issue. Lack of communication will be a severe risk. If I do end up taking this trip, I will investigate the options including SPOT, HF radio, sat phone, etc. Has anyone here done this? Does anyone here live in northern Ontario or Quebec? EDIT: Okay, this only brings technically goes to James Bay... But how does anyone get further north than this?? I’m not sure I would want to, but I can see that town exist for their north. Planes? Huge off-road vehicles? Dog sled teams??",a6byby,self.canada,,True
Cost of Living - Toronto,canada,"Just wondering what the Cost of Living in Toronto. Would $120,000CAD get you far?",a75380,self.canada,,True
Is your city offering free transit tonight?,canada,"Either way, stay safe out there tonight. Happy New Year!",abbl80,self.canada,,True
"Canadian 'yellow vest' protests mistakenly emulating a left-wing movement that demands social justice, more public services and higher taxes on the rich in France...",canada,[deleted],a6shlw,self.canada,,True
Quebec’s premier is wrong to label Alberta oil as ‘dirty energy’,canada,,a6jm77,thestar.com,,False
There’s a growing chance the Bank of Canada is done raising interest rates.,canada,,a42hfx,bloomberg.com,,False
"“Back home we ride horses, not unicorns,” ~ Rachel Notley",canada,,a5vind,economist.com,,False
Canadian arrested at Amsterdam Schiphol Airport after New Year’s Eve bomb threat,canada,,abcte3,globalnews.ca,,False
How much it costs and what the process is to pardon your cannabis conviction in Canada,canada,,a3tgb7,extractmag.com,,False
Brampton Politicians Speak Up On Alleged Sikh Extremism in Canada,canada,,a77fca,inbrampton.com,,False
"Victoria councillors look to reduce Christmas decorations, broaden diversity",canada,,a4ccbi,timescolonist.com,,False
"Legault defends plans to ban religious symbols, replace school boards",canada,,a610wd,montrealgazette.com,,False
Election reform bill passed in time for implementation in 2019 federal vote,canada,,a53vqt,theglobeandmail.com,,False
A real-estate agent and a former Huawei worker are among sureties for Meng Wanzhou,canada,,a7o5f2,theglobeandmail.com,,False
Economic outlook for 2019 may not be as rosy as 2018,canada,,a9zyxm,cbc.ca,,False
Spill raises new questions about fast-growing N.L. oil industry,canada,,a70vxh,cbc.ca,,False
Immigration fraud trial underway in Charlottetown court,canada,,a33g77,cbc.ca,,False
How do Canadian provinces fare in terms of GHG emissions per capita?,canada,,a38qvy,iedm.org,,False
What would you think about your province joining the US?,canada,,a3ginu,imgur.com,,False
Singh tries to rally his troops as the NDP struggles to gain traction,canada,,a35pjt,ctvnews.ca,,False
"After we opened our presents, we walked down to the neighbourhood rink to play some hockey, where I snapped this photo of all the neighbours playing together :)",canada,,a9ikjv,i.imgur.com,,False
Two young children found at east Edmonton apartment were stabbed to death: police,canada,,a534xt,globalnews.ca,,False
"It’s advantage Liberals going into 2019, with Conservatives needing a Trudeau stumble",canada,,a81gla,globalnews.ca,,False
Trudeau unacceptably smears construction workers,canada,,a2xe3y,torontosun.com,,False
Federal Conservatives would win majority if election held today: Forum poll,canada,,a4lsvw,torontosun.com,,False
Alberta separatism will rise unless Canada gets it right on pipelines,canada,,a5jjhd,edmontonjournal.com,,False
The Great White North,canada,[deleted],a2wx4q,theglobeandmail.com,,False
Canada must stand up to China the bully,canada,,a5ydt7,theglobeandmail.com,,False
Crossing the border illegally into Canada was the only option left for me,canada,,a6yly3,cbc.ca,,False
"George H.W. Bush made good relations with Canada a top priority. On his first trip to Ottawa as president, Bush assured Mulroney he would soon introduce environmental legislation to curb acid rain, paving the way for a bilateral accord with Canada",canada,,a21bgi,cbc.ca,,False
Ex-Harper immigration minister calls out Scheer over 'factually incorrect' statements on UN migration pact,canada,,a3nvr0,cbc.ca,,False
Doctors should do more than heal — they should be public health activists,canada,,a2f82m,cbc.ca,,False
Is Canada Goose facing a boycott in China?,canada,,a5ned7,bbc.com,,False
A Canadian Christmas!,canada,,a9jti6,i.redd.it,,False
The Dutch town of Groesbreek honoured all the fallen Canadian soldiers that died fighting for Europe’s freedom on Christmas Eve. We are thankful for your service Canada.,canada,,a9df0n,i.redd.it,,False
Canada among targets of alleged Chinese hacking campaign,canada,,a80e2o,ctvnews.ca,,False
My friend is moving to Canada (Toronto). Help me put together the most Canadian gift basket,canada,"She'll be moving there in a few months, I want to put together a gift basket introducing her to everything Canadian. Partly a care package, mostly fun so, Maple syrup ? and what else? I was going to get her a Wayne Gretzky jersey but I wasn't sure if it's right to get someone in Toronto an Oilers jersey. edit: She's moving from the Middle East, so warm clothes as well? I live in Seattle. Help me out! ",aba5la,self.canada,,True
Can you carry alcohol on a plane?,canada,[deleted],a8vv7w,self.canada,,True
The Canadian Identity in the 21st Century,canada,"As a Canadian born and raised, I feel lost. It seems to me like Canada as a whole is losing its cohesiveness. Before I fill in the blanks with what I think on why this is, I'd like to ask you all: What is it to be a Canadian, and why are we losing our identity?",a6bjwl,self.canada,,True
Andrew Scheer’s Conservatives are taking a worrisome turn on migrants,canada,,a433zg,thestar.com,,False
HydroOne’s take over of Avista rejected by Washington state regulators citing political interference by Doug Ford’s Ontario government,canada,,a3iggp,thestar.com,,False
I am irritated and embarrassed by how Albertans are acting,canada,[deleted],a5bo3j,self.alberta,,False
Danielle Smith: UN Migration Pact part of the plan to extinguish Canadian identity - Calgary,canada,,a3crfi,globalnews.ca,,False
The volunteers welcoming refugees on Canada's 'new underground railroad',canada,,a9gtzb,theguardian.com,,False
"John Ivison: Really, finally, truly, 2019 could be the year Elizabeth May’s Green Party breaks through",canada,,aavpqj,nationalpost.com,,False
"Students with Chinese origins are 40 percentage points more likely to attend university than those with Canadian-born parents. That means that almost three-quarters of students with Chinese origins attend university, more than twice the rate among students with Canadian-born parents",canada,,aayo3k,vancouversun.com,,False
Quebeckers don’t want to pay for the carbon tax,canada,,a5m96n,theglobeandmail.com,,False
Glaciers in Western Canada retreating at unprecedented pace because of climate change,canada,,aa312a,theglobeandmail.com,,False
Franco-Ontarians protest Ford government's cuts to services for French speakers.,canada,,a28tch,toronto.citynews.ca,,False
"Some hard truths for Western politicians on Quebec, equalization and oil | CBC News",canada,,a63izg,cbc.ca,,False
Trudeau says it's worth 'pointing out' similarities between Scheer and Harper,canada,,aalha2,ctvnews.ca,,False
Painful side-effects from laser eye surgery linked to man's suicide,canada,,a65hvx,ctvnews.ca,,False
Visiting the USA after purchasing from OCS?,canada,"I’m still super confused about what’s going on with legal Canadian pot usage and purchase and how it affects travel to the USA. Are they able to tell if I’ve purchased? I buy it with a TD VISA card. And what questions can I expect, if any? Any advice is greatly appreciated as I’m going across the border for a work get-together. I’m not working in or investing in the cannabis industry. Just use pot occasionally. I’ve read that one should be honest. But a lawyer in the USA said to just refuse to answer the question because that would just get you turned back for the one time instead of a lifetime ban. ",a4gvr1,self.canada,,True
It is time,canada,[removed],a6ixsh,self.canada,,True
Have you ever moved to another province without job or place to live ?,canada,I'm in Quebec and i'd like to move to Alberta. However i don't have a job in Alberta but i'm planing to search for one once there. The only problem is that i also need a place to live. How can i manage to get an apartment without a job (at first) . The only thing i have is enough money to live for about a year. How would you proceed ? If you did a province move how did it go ?,a8fcnc,self.canada,,True
Banning handguns in Canada may be mostly symbolic but at least it’s a start | The Star,canada,,a6hqez,thestar.com,,False
"GoFundMe seeks $34,000 for veteran’s prosthetic leg after Canada’s military refuses to pay",canada,,a69cag,globalnews.ca,,False
You’ll be footing bill for freeloaders with guaranteed income,canada,,a86b96,torontosun.com,,False
Victim of Ganatchio Trail beating dies 14 months after assault,canada,,a8t1ct,windsorstar.com,,False
Sesame Street’s long time resident Oscar the Grouch is secretly...a Canadian?,canada,,a7c14r,en.wikipedia.org,,False
Trudeau says Conservatives putting Canada’s future at risk with immigration ‘misinformation’,canada,,a6z7qr,nationalpost.com,,False
"TIL the largest movement of physical wealth in history was during WW2, Operation Fish had 186,332 gold bars and more than 8 million ounces of gold coins sent to Canada from the UK with not even one crate or treasury bill going missing.",canada,,a9lgit,canadashistory.ca,,False
Canada Post suspends delivery guarantee,canada,,a3hmja,ottawa.ctvnews.ca,,False
Flag of Franco-Ontario to fly outside the Quebec National Assembly,canada,,a20bkk,montrealgazette.com,,False
Canada's annual inflation rate drops sharply on lower gas prices,canada,,a7mx4w,ca.finance.yahoo.com,,False
Any good Canadian conspiracy’s?,canada,"I’m no tin foil hat conspiracy person, but I do like to venture down the rabbit hole and look at things from both sides of the fence and make my own decisions on the truth. But I find most of the big ones that you can really find some crazy theories and did into the findings of these theories are all American. (9/11, JFK, the wars etc) so what I’m wondering is there any good Canadian based ones that are good to delve into? EDIT; thanks every one got so much more than I thought; kind of like a Canadian history lesson. ",a8nd8u,self.canada,,True
Canada has arrested Huawei’s global chief financial officer in Vancouver,canada,,a3h3d2,theglobeandmail.com,,False
Bail hearing for Huawei CFO resumes in Vancouver amid international pressure,canada,,a4zk02,cbc.ca,,False
Brian Mulroney to give eulogy for George H.W. Bush,canada,,a270su,cbc.ca,,False
Justice Department issues new guidelines on prosecution for non-disclosure of HIV status | CBC News,canada,,a2gu3m,cbc.ca,,False
Winnipeg woman to fly 350 pounds of food to remote northern First Nation,canada,,aa5tix,cbc.ca,,False
Huawei boss faces fraud charges over Iran,canada,,a431px,bbc.co.uk,,False
Canadian gift basket!,canada,"Hey guys, so my sister is living in Poland and she's coming back to Ontario for the holidays! Aside from Maple syrup, what else should I put in the basket? Thanks all and Happy Holidays!",a6oski,self.canada,,True
What are your general perceptions of the current running candidates for PM 2019?,canada,"Probably something that comes up a lot but I was just curious what everyone's general thoughts on the Liberal, Conservative, NDP, Green and PPC leaders. Try to keep it as civil as you can for a political question. :)",a2br9l,self.canada,,True
Albertans do not realize how rich they are…,canada,[removed],a6ukpp,self.canada,,True
Legality of buying Marijuana from First Nations Reserves?,canada,"Hey, the First Nations area next to my town has had a bunch of dispensaries pop up. I'm wondering if you can legally buy from them... how are they allowed to pop up? There's like 5 in a 1km radius. They just sell it to anyone, cash, no tax... like what?",a8ajgi,self.canada,,True
MP Michelle Rempel just called Minister Of Immigration Ahmed Hussen a 'Chicken'!,canada,[removed],a7cys3,self.canada,,True
"USA Today readers rank Jasper, Alberta as the #1 ski town in North America",canada,,a5hn9o,globalnews.ca,,False
CN Rail working to firm up pilot plant partners to make oilsands bitumen pucks,canada,,aap5xv,globalnews.ca,,False
Who knows where Bonify got the pot it shipped out to meet demand? Not investigators,canada,,aaahji,nationalpost.com,,False
Why no oil tanker bans for Quebec?,canada,,a71o6c,calgaryherald.com,,False
Notley: One of the toughest decisions we will make as a province,canada,,a1yyo9,calgaryherald.com,,False
Thousands demonstrate in Ottawa for French-language rights,canada,,a29gom,ottawacitizen.com,,False
Canadian dollar lags most other G10 currencies as stocks retreat,canada,,a70xj6,theglobeandmail.com,,False
Why are Canada’s oil patch CEOs changing their minds on carbon pricing?,canada,,ab67ca,theglobeandmail.com,,False
The Trudeau government's Trans Mountain purchase has triggered staggering interest expenses,canada,,a3jgvt,nationalobserver.com,,False
Civilization VI: Gathering Storm - First Look: Canada,canada,,a57kvb,youtube.com,,False
Success! Canada passes bill to repeal its blasphemy law,canada,,a5unco,humanism.org.uk,,False
Chinese shoppers take aim at Canada Goose as Huawei story prompts boycott talk,canada,[deleted],a59d9f,cbc.ca,,False
"Stop posting videos of shoplifters, N.L. privacy commissioner says",canada,[deleted],a5yks6,cbc.ca,,False
"R/Canada, do you think the Hudson Bay/Sea belongs to Canada or international waters?",canada,I'm reading the wiki page and I noticed there is a dispute over the sovereignty of Hudson Bay. I am curious to know if there re any good reasons to consider Hudson Bay as part of Canada. EDIT: from the wiki page. Some sources describe Hudson Bay as a  and has claimed it as such on historic grounds. This claim is disputed by the United States but no action to resolve it has been taken. &#x200B; &#x200B; EDIT2: Thanks to all who provided resources. I think we should update the Wikipedia page to include more detail of Canada’s ownership instead of dismissing it. Not sure how though.,a4xoce,self.canada,,True
An honest inquiry,canada,[removed],a6nb7a,self.canada,,True
"National Post's F-35 Coverage, Harper v Trudeau",canada," I find this quite amusing, so when the Conservatives were in power and were in favour of the F-35, the National Post's F-35 coverage, would make you think that the F-35 was a white elephant, an expensive toy and totally ill suited to Canada defense needs. You would either come to the conclusion that the F-35 procurement was the product of corruption, or a Conservative government simply too gung-ho about military spending. ",a3v87v,self.canada,,True
"Yo, got any good Canadian YouTube channels or podcasts?",canada,"Preferably educational or infotainment. Imagine Tom Scott, but Canadian. Or JJ McColollugh. If it's got a Canadian bent/focus, all the better. Thanks in advance!",a6k98c,self.canada,,True
New report shows blacks in Toronto are twenty times more likely to be shot by police than whites,canada,,a53wij,globalnews.ca,,False
Insurance company continues to bill widow after she cancels husband’s auto policy,canada,,a2a86z,globalnews.ca,,False
Trudeau’s politicization of refugees toxic and divisive,canada,[deleted],a78kak,torontosun.com,,False
Does Justin Trudeau realize just what he’s really done in the Senate?,canada,[deleted],a73pul,nationalpost.com,,False
"Trudeau defends his approach to Mali peacekeeping, and says world supports Canada on China detainees",canada,,a97i7t,theglobeandmail.com,,False
CSIS director warns of state-sponsored espionage threat to 5G networks,canada,,a3hzz7,theglobeandmail.com,,False
Building blocks of ocean food web in rapid decline as plankton productivity plunges | CBC News,canada,,a8xabu,cbc.ca,,False
"The grievances we feel in Alberta are legitimate, but we need to cool our jets",canada,,a8926q,cbc.ca,,False
Mike Pompeo speaks out agaisnt detention of Canadian citizens by Chinese authorities-US finally standing up for us?,canada,,a68ohu,cbc.ca,,False
Scrapping $15B arms deal would barely hurt Saudis: former CSIS director,canada,,a2eo7a,ctvnews.ca,,False
Chinese State Councilor and Foreign Minister Wang Yi: China will not allow rights of its citizens to be harmed,canada,,a54dzb,google.com,,False
Why Andrew Scheer is spouting nonsense about GM,canada,,a223s3,macleans.ca,,False
Should I be concerned to visit China?,canada,"I'm a 22 year old Canadian citizen who is travelling to Chengdu, China for a week in January. This is the first stop on my 3 month long trip across Asia. With now 3 Canadians being detained in China, should I be worried about going? I have a travel visa and am currently unemployed.",a7paya,self.canada,,True
Canadians are not nice,canada,[removed],a8hd69,self.canada,,True
Student Minimum Wage should be 8 dollars,canada,[deleted],a5anxg,self.canada,,True
Oil Squeeze Widens Canada's Trade Deficit More Than Expected,canada,,a40ivh,bloomberg.com,,False
Whistler Request for Oil Sands company to cover climate change expenses causes outrage,canada,,a64tfy,globalnews.ca,,False
Jason Kenney says he will demand energy industry CEOs 'get in this game' against anti-oil activists,canada,,aalken,nationalpost.com,,False
"TIL: While Ontario cancelled the French University that would have cost the province $12 million a year, Quebec has been spending $626 million a year on its 3 English Universities, McGill, Concordia and Bishop, that's more then $200 million a year per university on average... [French link]",canada,[deleted],a49it3,ici.radio-canada.ca,,False
"Canadian tech companies are attracting more overseas talent, but brain drain to U.S. continues",canada,,a3ivrw,business.financialpost.com,,False
"‘Alberta is angry,’ says political strategist who predicts big trouble there for Trudeau's Liberals in 2019",canada,,a4utuv,hilltimes.com,,False
Two young girls found dead in Edmonton,canada,,a4622e,cbc.ca,,False
Out in the cold: Canada's year in foreign policy,canada,,a7wegp,cbc.ca,,False
Canada’s Health Minister Says Opioid Crisis Deaths Have Surpassed AIDS Epidemic,canada,,a24o6d,vice.com,,False
Indigenous poet faces backlash for calling out NHL-themed totem poles,canada,,a5xssu,ctvnews.ca,,False
Alberta has never had a one-term premier. Will Rachel Notley be first?,canada,,a830rl,macleans.ca,,False
We're out of allies (about the arrest of two Canadians in china),canada,[deleted],a6c2we,self.canada,,True
I've seen more Huawei cell phone ads this week than in my entire life,canada,[removed],a74r3j,self.canada,,True
"Age and political leanings best indicate where Canadians stand on climate change, new poll shows",canada,,a245nj,thestar.com,,False
"Canadians have different concept of nationalism than U.S., surveys show",canada,,a4t9kk,globalnews.ca,,False
CSIS director warns business leaders of ‘state-sponsored espionage in Canada’,canada,,a35ch2,globalnews.ca,,False
"Is Canada Heading Into A Nasty Election Year? Trudeau, Scheer, Singh And May Reveal What’s Ahead",canada,,a6ue2n,chatelaine.com,,False
Omar Khadr keeps coming back for more – and still shows no regrets,canada,,a5bjws,torontosun.com,,False
"Cryptocurrency Scams Are on The Rise in Edmonton, Canada - CryptoMeNow",canada,,a5o0w2,cryptomenow.com,,False
Ekos Research Poll (Ontario): PC 34 (-7); Liberal 28 (+8); NDP 26 (-8); Green 9 (+4) Chgs. w/ June 2018 election,canada,,a4hpji,ekospolitics.com,,False
TSX marks new two-year low | Investment Executive,canada,,a935vx,investmentexecutive.com,,False
"Ex-Liberal MP Raj Grewal must divulge who lent him millions to fuel gambling habit, opposition demands",canada,,a3djpx,nationalpost.com,,False
Thunder Bay Public Library moves to 'decolonize' after 2 reports critical of racism in city | CBC News,canada,,a7xjqf,cbc.ca,,False
Could expanding the role of pharmacists alleviate pressure on health-care system?,canada,,a7bf76,cbc.ca,,False
How my son and I approach holiday celebrations as Muslim Canadians | CBC,canada,,a4f3gw,cbc.ca,,False
This formerly 'vaccine-hesitant' mom has a message for Canadian doctors | CBC Radio,canada,,a43okb,cbc.ca,,False
"A Quebec City man called a cop a douchebag on Saint-Jean. He contested his ticket, but a judge ruled he must pay $150",canada,,a8c283,cbc.ca,,False
Unemployment rate for immigrants to Canada at lowest level in years,canada,,aacsik,ctvnews.ca,,False
"CTV News: 'You will be caught,' ministers vow ahead of compulsory breath tests for drivers",canada,,a357xc,ctvnews.ca,,False
