body,link_id,subreddit
If only they start with you...,t3_a8behi,TheNewRight
"Yeah, you're not white.",t3_a8behi,TheNewRight
"And yet, somehow he is still arguing his own words.",t3_a37op1,TheNewRight
,t3_a7x3cc,TheNewRight
"Right. You guys have the highest murder rate in the country if I’m not wrong. The thing is, St. Louis has a smaller population than Chicago, and therefore less crime. I think it’s about 60 murders per 100,000 people in St. Louis and 30 per 100k in Chicago. Chicago has a population higher than many cities in the midwest. Add the area known as Chicagoland, and you get 5 times the figure from before. Also, Chicago went higher than it has in about 20ish years in 2016 with 762 murders. ",t3_a0v6vt,TheNewRight
"Go back and read it and get back to me and make a point or go back to watching fox news and screaming about librrrrulllllsss. You're in our sub and you've addressed in my initial comment besides acting like an obnoxious, smug prick. Then you started trolling, I called you out, you asked me where, I showed you, and then you continue ducking me and responding with 'nuh uh'. ",t3_a6t9fd,TheNewRight
"liberals want big government. take away taxes and you take away government. it is anti-liberal. If you're not being sarcasting, you're a big-state bootlicker.",t3_a7x3cc,TheNewRight
"You like Trump because he is a liar, a fraud, and now a soon to be felon. You sound like a bunch of winners..SMH.",t3_a3zm2c,TheNewRight
Armenians are Middle Eastern,t3_a8behi,TheNewRight
I am not sure which phobia you are about to throw out in the open. ,t3_a3dtwh,TheNewRight
That's what you're doing.,t3_a6zzwo,TheNewRight
"Lol. A) it's sad you feel the need to check my post history, and B) who doesn't like endless shrimp?",t3_a23kal,TheNewRight
That would be funny if you actually knew anything about me. Statistically I can likely guarantee that I’m doing better than you. ,t3_a6p9q4,TheNewRight
I’m 28 but I feel like I’m 50. Can I retire soon? ,t3_a0ym3t,TheNewRight
Sex at birth isn't the same as gender. We can have this conversation if you're willing to have it in good faith.,t3_a0ym3t,TheNewRight
"The moral of the story is u/Aldebaran333 is lying about military service in order to 'win' an arguement online, and the mods here allow it.",t3_a2vu47,TheNewRight
I would bet money you have no muscle mass. Like skinny fat guys...,t3_a32izq,TheNewRight
"Why not? You just said they're Semitic, so therefore they *are* no different than jews.",t3_a8behi,TheNewRight
"These people are protesting pro-business and anti-social welfare moves from Macron. Soooo, sure?",t3_a3n3h7,TheNewRight
NXIVM. They act charitable to reel you in and make people turn a blind eye. ,t3_a7ptv8,TheNewRight
You probably tell people the Civil War was about State's rights.,t3_a2fvrx,TheNewRight
"German secret police, wonder when I heard that before... Oh that's right, the Gestapo in 1939. You do you, Germany ",t3_a7blx7,TheNewRight
Maybe Europe will save itself.,t3_a47r49,TheNewRight
should've been alex jones smfh. ,t3_a571cd,TheNewRight
[deleted],t3_a8e8z6,TheNewRight
"The last time? Carter, Clinton, Obama: all patriots. ",t3_a5x6ct,TheNewRight
Yet another example of ths entitled spinning diversity as an attack. 'The nerve of people with different skin colors and religions to think they are equal!' ,t3_a2ncth,TheNewRight
"I wanna get in your vault, girl",t3_a8behi,TheNewRight
"That’s because he knew what he said prior was nothing short of fascist. “Thank God you citizens have the first amendment, otherwise I’d prohibit your free speech.” The comment he made isn’t okay regardless. ",t3_a5oryu,TheNewRight
I assume you hate any non white non Protestant don't worry. I understand you only like white people who support your made up stupid god. People like you is why abortion needs to stay legal it's all good. ,t3_a37op1,TheNewRight
[deleted],t3_a53wvr,TheNewRight
"Aye, she sent her antifa supersoldiers pumped up with Soros Serum to send him coded pizza messages.",t3_a5x6ct,TheNewRight
"I thought you guys hated refugees? Because the dead were all Christian Ethiopian refugees trying to reach Europe through Libya. Yeah, I bet some of you are feeling conflicted now.",t3_aapj4h,TheNewRight
I like Karma and participating in Reddit. ,t3_a5jjvw,TheNewRight
"Hey dude white/ black has nothing to do with race, it's just a description of skin color. And before you tell me I don't know what i'm talking about I will inform you that I too have skin and know what it is. ",t3_a8behi,TheNewRight
"   I'd post more, but I fear I have already lost you.",t3_a2ne07,TheNewRight
No. For whatever reason that site refuses to stick to one font size. As far as the article it says that Bruce's father is Dutch (he's American) and his mother is Italian (she's American) and gets his father name wrong. It also attempts to belittle him for going to a psychiatrist. Clearly mental health is as taboo in altright circles as equality.,t3_a35auu,TheNewRight
They pay taxes with stolen or fake SS numbers. Not a net positive.,t3_aabtll,TheNewRight
Hmm... interesting allegations. Also interesting: ,t3_a64zb9,TheNewRight
"The lady is probably not a physicist AND quantum theory is as much a fruit of Western culture as is Newtonian physics. Let's be real. All the physics field is DOMINATED by make whiteness and Western culture, and thanks for that. PS: Feynman was the best.",t3_a9np2d,TheNewRight
"I feel that we are too far removed from our community, family, and personal issues, and just focus on the national policies. I feel that Democrats and many conservatives use the fear of deportation and entitlements to secure immigrant votes (not illegals themselves, but their children and the people they are close to). This is just voter dependence as their way of life is contingent on electing certain politicians. This doesn’t alleviate any problems the voters may actually have. There is no pressure to ever do anything other than increase their dependence. More welfare, more amnesty, more relaxing of immigration enforcement. It does nothing for long term community stability. We cannot afford to take on millions and millions at a net tax loss. We need to focus on small business development and public education to build communities up from the bottom.",t3_aabtll,TheNewRight
"It's true. I think they're moving up to 5th, or already have. ",t3_a5oryu,TheNewRight
It sounds like youre about to cry bud,t3_a16d3u,TheNewRight
..... This is an ad... A company that wants to sell you email campaigns did this 'study'.,t3_aampn1,TheNewRight
Check my post history for a call to ban this pancake troll. Plz support ,t3_a3cbfd,TheNewRight
">Like people you didn't even know, just heard enough to form an opinion and off you went. Like you did just now? You have to learn to relax, man. ",t3_a77fb5,TheNewRight
Except yup.,t3_a7x3cc,TheNewRight
SNL's fake news? Your username already gives away that you don't fact check ,t3_a998y7,TheNewRight
Democrats dont subscribe to 'i must support every single thing anyone in my party says or does.' Both sides are not the same here ,t3_a5oryu,TheNewRight
"My taxes went down and I'm middle class. The tax bill lowered taxes for Trump's base and raised taxes for blue state residents, because of the decreased salt deductions. Your taxes might have gone up, but I'm not complaining. ",t3_a2ne07,TheNewRight
Yeah. Except none of that happened. ,t3_a6910h,TheNewRight
"Meth, not even once.",t3_a2xzf3,TheNewRight
"It's absolutely, positively, 100% not. ",t3_a3dquw,TheNewRight
"Victoria has a secret, lol..",t3_a0ym3t,TheNewRight
Here’s a great example:  the right was waiting with baited breath for this report. And cleared. Again. ,t3_a5x6ct,TheNewRight
I'm not trying to troll the conservatives or anything. I am genuinely interested in their beliefs. ISTM that their 'cuck' metaphor doesn't work for progressives and I'm posting about it to see if anyone can show me that I am wrong. ,t3_a8kp4h,TheNewRight
"Hahaha holy shit man take your meds, honestly. I’m actually not convinced that you’re not a chatbot that just learned hyperbole. And educate yourself, jackass!  * ",t3_a7uiso,TheNewRight
"Oh ok I guess the media circus around Obama's birth record doesn't count. The non scandal of Uranium One seems to have died down though, so that's nice. ",t3_aampn1,TheNewRight
What?,t3_a6p9q4,TheNewRight
They better! Far too beautiful a place to let fall to invading hordes of murder and rape obsessed garbage OR to this wet dream of Venezuela crybabies have during nap time in their safe spaces.,t3_a47r49,TheNewRight
"Reading comprehension isn’t your thing huh? I’m disgusted with how the left is propping up people with mental illnesses suffering from delusions so intense, they want to mutilate their own genitals. And you people support it. These people need deep psychological help, not some scrawny male feminist demanding that grown men can use whatever bathroom they want so their beloved democrat party can get more votes You don’t want fair treatment for everyone, you want to virtue signal and pretend you’re on some righteous crusade for justice when in reality you are taking advantage of extremely mentally disturbed people and telling them that it’s normal, and that they can become whatever they want to be. Nothing about you is genuine. Everything you support or “fight for” is a flavor of the month, once you have no use for these people you’ll move on. Liberals are absolutely the fakest group of people I have EVER interacted with in my life. By far. ",t3_a0ym3t,TheNewRight
I fixed it,t3_a4oor3,TheNewRight
Or accept reality.  ,t3_a998y7,TheNewRight
Socialism is EVIL,t3_a6phqc,TheNewRight
"'negative Mueller news' - what do you mean here, exactly? Oh the treason! You mean the treason.",t3_a5jjvw,TheNewRight
I am jack’s complete lack of surprise. ,t3_aaa56l,TheNewRight
Stop posting this garbage - You make the right look bad The only thing that makes the right look bad is the fucking mods let this sub get so over run by you Democrat trolls that you have the balls to waltze in here and tell US WHAT TO SAY AND DO. ,t3_a3dquw,TheNewRight
Bill O'Reilly went to Harvard.,t3_a8onny,TheNewRight
[deleted],t3_aa0hwk,TheNewRight
"It's the same size minority here that's whining about it. The truth is, the majority don't give a fuck. So it's minority vs minority. And it's seriously not even close to comparable. It's the radio station deciding not to play the song, for it to be like book burning there would have to be an outside authority telling them not to play the song. The radio station has it's own discretion. Anyone can get a radio license and play this song on air therefore the book is not burned. ",t3_a3dquw,TheNewRight
Things that are different are scary and wrong.,t3_aba6p2,TheNewRight
[deleted],t3_a7ptv8,TheNewRight
"I'm a bot, *bleep*, *bloop*. Someone has linked to this thread from another place on reddit: - *",t3_a31h4r,TheNewRight
Maybe she just hates her kids? Lol why am I getting downvoted?,t3_a2sbx3,TheNewRight
This entire sub is four accounts astroturfing hate.,t3_a1xdli,TheNewRight
,t3_a37op1,TheNewRight
She is perpetuating the Fourth Reich. See through it and fight it. This shit needs to die.,t3_aaf6c5,TheNewRight
A non-white person.,t3_a8behi,TheNewRight
Its not dry if you cook it right. I dont particularly like gravy so i wouldnt put that on it anyway. Something about left over grease/fat from cooking with some flour and spices to make it into gravy...nah,t3_a8behi,TheNewRight
I agree. Seeing little girls caked in pounds of makeup is disgusting. All children need to be protected from this sick shit. ,t3_a6t9fd,TheNewRight
I do.,t3_a2n2c3,TheNewRight
"The thing you are missing is none of that is actually happening as it illegal to do to a child. Which the mother, a doctor, is aware of. The misinformation is not the dangers and problem with hormone therapy, it is that it is not actually happening. It's a money grab. ",t3_a2j81e,TheNewRight
"Haha, it's me again! God bless all the work you put in! You're everywhere OP! ",t3_a4kky4,TheNewRight
"Unless you get rid of ER services, you need to have a mechanism for people to pay into the system. We have a form of universal healthcare in that I can walk into an ER without ID and get healthcare. I can provide random info and walk out without ever paying a bill. Those costs (risk) get applied to next years premiums for people that have health insurance. So we’re literally doing it anyway but we’re doing it in the most expensive, worst way possible. That was partially what the individual mandate sought to solve.",t3_a70kmb,TheNewRight
Diversity + Proximity = War,t3_aaccq5,TheNewRight
Nobody is trying to capitalize. The father is trying to defend his kids. The money is so he can do that.,t3_a2j81e,TheNewRight
"I want to help children. Let anybody see for themselves if thus is a money grab or not. What concerns me is people who attack people who want to help children. Anyways I won't be responding further. Your attempts reveal you for who you are. I say to you, you have the choice as to whether you want to harm children or help children. Best of luck.",t3_a2j81e,TheNewRight
They should sell pieces and sections that if you purchase one a prisoner puts your name on it.,t3_a6ev6x,TheNewRight
There is no place for white supremacists like yourself in this subreddit.,t3_a0v6vt,TheNewRight
You should not have been banned?,t3_a0v6vt,TheNewRight
I’m not the only one living in reality. There are WAAAAY more of me than there are weirdos like you living in fantasy land.,t3_a0ym3t,TheNewRight
It’s awful and only serves to amplify crime and poverty. Its not like we can do anything about it though.,t3_a0v6vt,TheNewRight
"Taxes, healthcare, guns? Republicans have been doing that for the last 30+ years and its had 0 effect. The average black or hispanic person on the street couldn't care less about the minutiae of tax policy or healthcare policy. Generally, 'normies' who aren't into politics don't understand this stuff, and they don't care. Even Trump understood that, which is why he speaks at like a 5th grade level during his rallies. Blacks historically used to vote republican. Do you know when they switched over? In the 1930s because of FDR and The New Deal...and it has been that way ever since. The left brands the right 'racists', they promise free shit, and blacks/hispanics vote for them. I'm sorry but speeches about the free market and low taxes cannot compete with 'The other side is racist and I'll give you free healthcare and free school' . I think the time to try persuading minorities with convincing technical arguments about taxes, guns, etc is over. We've been doing it, it hasn't worked, people continue to vote in a tribal manner. ",t3_aa2ogh,TheNewRight
Lol you guys are fucking unhinged. ,t3_a5traz,TheNewRight
What a delusional fool. Of course were that the case you could draw the same line into the GOP being the Good Old Nazi Party.,t3_a99e1t,TheNewRight
He had a plan for them to. The best chance he had for that plan and the wall in general was in the first 6 months.,t3_a7x3cc,TheNewRight
"Hah! Even the writer of the article doesn't read his own article. 'Miller writes: Bosses of the world’s largest corporations are still learning to deal with one modern peril: when President Donald Trump shows he’s not afraid to call them out on Twitter. So far, Miller used five aggressive verbs – attacked, thrust, parry, call out, and ignore, and a negative noun, peril. We are off to an unhappy start.' ",t3_a3bkxc,TheNewRight
"No, it’s a crime to take advantage of a woman without her consent, regardless of her sobriety. That’s why the rapist got charged, convicted and sentenced to five years prison time (suspended due to his otherwise clean record) and removal of his “civil rights” for five years. Read the actual article, not the Breitbart/VoE clickbait. ",t3_a6py7r,TheNewRight
"“what the frick you cant use examples that prove me wrong” Also, this was about French Canadians being any more likely to protest just for being French, not voting lines. Also French People are white. So you’re “argument” is double irrelevant. The biggest divide in voting is urban/rural. Most immigrants live in urban centres. They’re going to vote most similarly to other urban dwellers, not rural people. ",t3_a47r49,TheNewRight
It's funny because this is the sort of thing the left would be railing against with all their might if it were their point of view being squashed. ,t3_a5oryu,TheNewRight
 Continue crying sweet tears as I slap you with the truth and crush your ignorant soul.,t3_a8behi,TheNewRight
"Dude, it's the HEADLINE. They are mis-representing (for no good fucking reason) the headline statistics. So yea...that's why I'm 'cherry picking' this one. It is the one that they present first!! You're not helping your position...",t3_a5353g,TheNewRight
Wow. It's amazing how just one thing someone can say can really make your day. Thank you. Very much! Kind of stunned this sentiment almost never happens on Reddit! ,t3_a48d9l,TheNewRight
>links to wikipedia page that doesn't prove his point >ME POST FACT,t3_a2ne07,TheNewRight
"Posts should be on topic for /r/TheNewRight. So... not leftist viewpoints. Your post history makes it clear you're not a conservative. Two wrongs don't make a right. Shitposting should be dealt with by mods, not by retaliatory shitposting.",t3_a3ds7v,TheNewRight
I started my car a few hours ago to run an errand and the news break was talking about something from Charlottesville and it said 'WHITE nationalists in Charlottesville....' and I thought to myself really? Every video I saw of nationalists were much more diverse than Antifa! Why the 'white' in front of it?,t3_a3n3h7,TheNewRight
"I’m simply saying people receiving Medicare shouldn’t get to vote since they’re the beneficiaries of money taken at gunpoint from other people. You pay taxes in a weird way. So how would this society function if those you deem to be lesser than you have no say in the world around them? I mean the world revolves around balance. If you drastically shift that balance of power, how do you snuff out a revolt? Hell Paris is burning over much less.",t3_a7mgy3,TheNewRight
"No shit asshole. Hence my explanation as to why you paid no taxes. It wasn't Trump cutting your taxes, his plan saved you $30 and saved the top 1% hundreds of thousands of dollars.",t3_a9hkwh,TheNewRight
It's like the attack on the death star.,t3_a3n3h7,TheNewRight
"Kiss my ass, you hack. If you didn't spam propaganda across subs - I wouldn't have to chase it down and correct it across subs. Look at you, mis-citing reddiquitte like a shrill, pathetic loser. Report me. I dare you. This doesn't bother me in the least - and, in fact, I hope it brings increased scrutiny on you and what you've been up to. I'm sure you'd like admins to see your record... /s",t3_a5cboz,TheNewRight
Would you like having people of a different race as your neighbor? Have you ever seen or experienced racism? I'll start. 1) Yes 2) Yes,t3_a9otjd,TheNewRight
"just dont get taken out by a rooftop sniper, fellow Europeans",t3_a3n3h7,TheNewRight
I don't think you should have that right.,t3_a2ne07,TheNewRight
"You are the one who brought up Obama, that was your strawman, you are literally holding it right now.",t3_a2rsgf,TheNewRight
Globalists agenda one world government ,t3_aaf6c5,TheNewRight
I just don't give a shit and don't understand why so many people do,t3_a64zb9,TheNewRight
"Gas is not 4 dollars a gallon where i live, or apparently where you live. quite the misinformation.",t3_a5oryu,TheNewRight
"1. We don't need a standing army. We didn't have one until after ww1, and we didn't need one then. The standing army was an excuse to create a central banking system and completely rob the american people. 2. The police are not our allies for as long as they are entrusted with being tax collectors, and for as long as they are not held accountable for their actions, and for as long as they are not elected or held to term limits.",t3_a7x3cc,TheNewRight
End game: >90 IQ. decrease average IQ to control population. ,t3_a56qap,TheNewRight
"I never discredited your source, I don't think of wikipedia as having a bias. Which can not be said for many on this sub.  It was a certainly a thing, former President H.W. Bush ran it. But after Watergate, one of the reporters who broke that story broke open Mockingbird. I do not doubt governement interference, their is governmental interference in everything However, with our president trying to discredit his detratchers turning people away from the actual news leads to a dangerously under informed country. ",t3_a998y7,TheNewRight
Everyone gets to decide through their vote. I am honestly quite shocked that you'd be willing to include Medicaid in that because that includes people who've worked their entire lives and retired. So now people who want to vote have to work until the day they die?,t3_a7mgy3,TheNewRight
"It happened to me too and for a lot longer for opposing neocon Bolton. Just chill and they'll let you back in. The mods are not the cool ones there used to be there, and I think they are neocon/leftist shills in many instances.",t3_a7f1ig,TheNewRight
He was 14 when the war ended. The former Pope was Hitler's Youth though.,t3_a32asl,TheNewRight
"I believe in science Let's test that, shall we? How many genders are there?",t3_a3dtwh,TheNewRight
Kill yourself fascist piece of shit,t3_a6ev6x,TheNewRight
"Leftists can't be cucks. We like multiculturalism That doesn't mean you aren't a cuck, it just means that you enjoy and/or rationalize it to yourself. ",t3_a8kp4h,TheNewRight
It’s called Trump derangement syndrome ,t3_a5jjvw,TheNewRight
"I already told you, so you would know which ex-Prez I was talking about. Look at you, somebody mentions race and you react. Like Pavlov and the bell. Bark for me. ",t3_a89y6w,TheNewRight
He was part of the swamp. A uniparty “Republican” like no other.,t3_a20gj8,TheNewRight
"Awww did your private school not teach you reading comprehension? Unlike you, it did. >I'm still waiting for you to answer. I already did answer you, it just wasn't the answer you wanted. If it's really too hard for you to figure that one out on your own(hint hint, liberal dog), AND you're too stupid to know basic history questions, I guess we'll just have to go to second grade. What two colors put together make green?",t3_a3dtwh,TheNewRight
">GET IT NOW? No, not really. Could you explain yourself a little more? And try to say it REALLY LOUD THIS TIME... ",t3_a3dquw,TheNewRight
Are you touched in the head?,t3_a6p9q4,TheNewRight
"Paul manafort alone coughed up 42 million, so i mean thats 25 million in profits just on his case. But go to work, im guessing your in the fudge packing business? Or is getting your fudge packed.",t3_a5x6ct,TheNewRight
"... It did not, but it has happened to plenty of women.",t3_a2n2c3,TheNewRight
The parents need to be brought up on charges...sick bastards,t3_a6t9fd,TheNewRight
You don't have to. Let other people alone with your neo Puritanism.,t3_a2n2c3,TheNewRight
I didn’t say they weren’t men or women. I said they’re not having kids.,t3_a0ym3t,TheNewRight
"Hey mods, why is this shill still allowed to post here? Deport his ass.",t3_a9hkwh,TheNewRight
"The whole idea of legal immigration is to allow people in who ***want to be American*** and assimilate to our customs, language and way of life, not to allow 'diverse' cultures to overtake and transform ours",t3_a8behi,TheNewRight
Wait so now you’re trying to claim private companies are public domain and I’m the communist in this conversation? The free market doesnt apply anymore because it’s “too hard” to beat the big bad liberal companies? Pull yourself up by your bootstraps son and learn how to code. ,t3_a5oryu,TheNewRight
Rachel Bolan for instance?,t3_a2mi6n,TheNewRight
[deleted],t3_a7ptv8,TheNewRight
Well done,t3_a8behi,TheNewRight
That doesn’t sound very Christian to me. ,t3_a48d9l,TheNewRight
Let Israel sort its own shit out. Why in the hell are we going in debt to fund other nations? Where are those upvotes coming from? I thought this was the new right.,t3_a2u2od,TheNewRight
On what spectrum?,t3_a9hkwh,TheNewRight
"Anti zionist (globalist) is not antisemitic, it is ideological.",t3_a18hd1,TheNewRight
I don't quite follow what spurred these responses and I'm not left,t3_a5x6ct,TheNewRight
You said you are connected to the communists. &#x200B;,t3_a998y7,TheNewRight
,t3_a9umrw,TheNewRight
No way an Armenian would like k*babs,t3_a8behi,TheNewRight
damn white kids and their video games grrrrrr video game vidya games gaahhhh grrrrrr ,t3_a8behi,TheNewRight
"I linked to where you brought up Obama you ignorant troll. Your reading comprehension is poor, you are a pathological liar, and you should feel bad.",t3_a2rsgf,TheNewRight
Good cause I always tested 100%,t3_a9hkwh,TheNewRight
"You are correct, and they most certainly are. But what ends up in spam is not the issue.",t3_aampn1,TheNewRight
I don't see a problem with that... it seems rational to me?,t3_a7yiil,TheNewRight
