body,link_id,subreddit
No one's laughing at China right now,t3_a6jryj,TheNewRight
"Yawn, two years of intense digging has found....... drumroll please..... absolutely nothing. :/ sorry moron, Trump is clean. ",t3_a6zzwo,TheNewRight
"Pretty defensive there eh? Thats exactly what PancakesAndAss would say. I didn't even have to look at your history to know, it's pretty obvious. Btw, say hi to your dad, my dad said thanks for the fun weekend. Maybe you can block me on this account too.",t3_a3feyw,TheNewRight
Please tell me how she’s a socialist. According to her Wikipedia page she only supports basic socialist benefits. She is also vehemently against the EU and globalization,t3_a8zmrj,TheNewRight
You can physically see the cognitive dissonance in full flow. ,t3_a4ejs2,TheNewRight
"Ohhh, you can't read... My bad.",t3_a97zl2,TheNewRight
With no scholarship getting into harvard is not a way to profit for years and years. It costs a fortune over 4 years. And do you have any evidence that he is profiting or that giving the speeches he gave and political organization he did really wasn't a sign of potential for success?,t3_a8onny,TheNewRight
Don't tell people how to feel.,t3_a3dquw,TheNewRight
"Sorry, but I’d be in jail after taking care of this problem ",t3_a2j81e,TheNewRight
And EU politicians to the gallows ,t3_a3n3h7,TheNewRight
"I have to admit, you are probably right. Most people don't actually care about any of the stuff that becomes 'controversial' online and in the news. Speaking strictly from within Reddit itself, though, I can' help but notice  and any of the other LITERALLY HUNDREDS of other posts and comments bitching and whining and complaining about how this is an example of SJW culture run amok. And, for some reason, I can't find any examples from the 'other side' other than the handful of radio stations that decided to stop playing it, comments from people on the left saying 'it's kind of a creepy song, but who really cares' and the occasional stupid comment that gets heavily downvoted. But maybe I'm just biased or something and I'm not looking in the right places.",t3_a3dquw,TheNewRight
Because conservatives are under constant attack by the media you fucking ignorant child. Read something other than huffpo.,t3_a4kky4,TheNewRight
"He doesn’t actually have a framework, neither does OP. They just want to disenfranchise large swaths of other people so that they will hold more power.",t3_a7mgy3,TheNewRight
"No, the death threat stories are true. ",t3_a8onny,TheNewRight
"I feel like it often comes hand in hand with politics. Socialists, for example does not understand economics at all. Capitalists do. Sure there may be some exceptions, but the left are generally worse at economics than the right. Socialists are also unable to think long-term.",t3_a6evpb,TheNewRight
I seriously doubt anyone on this sub has read any of his work.,t3_a9hkwh,TheNewRight
"on their own, both Democrats and Republicans are partisan by definition if they weren’t partisan, they’d be unaffiliated",t3_a5x6ct,TheNewRight
"That's how I feel about most conservatives these days, too ",t3_a2mi6n,TheNewRight
Well the money they earn at their jobs doesn’t belong to you,t3_a5353g,TheNewRight
"Look at OP's post history, it's not just this article, it's the two dozen other OP posts every day. Why did you feel the need to bring race up?",t3_aaa56l,TheNewRight
Here comes the t_d brigade!,t3_a3cbfd,TheNewRight
"Form a religion/church, deed your house to the church. Save on taxes!",t3_a7x3cc,TheNewRight
"why money just like volags make billions (see somali refugees in the 90s, and now, again... guess what, more somalis in last years into Maine... yeah that tropical climate. I wonder why Maine? well the CATHOLIC CHURCH and >>NON DENOMINATIONAL>organizations made BILLIONS last year... BILLIONS WITH A B) These other organizations range from people that game the system, adopting kids for cash - at best, exploitation at worst. People that run 'care homes', and organizations like Blake Foundation  - this was the organization getting hundreds of dollars a day so they could have an uppity bitch threaten the mother of this child, saying the child was bleeding and urinating on itself and screaming not because it had been raped but because the mother gave the kid some juice in the 1 hour a week she was allowed to see her own 4 year old daughter that was being raped and soon to be tortured. She lost the child for no reason, kidnapped by a gov employee with no papers, just a $5 incentive to meet a quota. Now they throw the whole system at them and tried to kill the kid to cover it all up",t3_a7ptv8,TheNewRight
"Try reading your entire article and not just the headline. 'But when the political lens shifts from partisanship to ideology, the participation gap vanishes. Self-described political conservatives were no more likely than liberals or moderates to have received food stamps (17% for each group), according to the survey.'",t3_a2tp9e,TheNewRight
"Naw thats just racist. Immediately doxxed, loses jobs, disowned by family ",t3_a85ypz,TheNewRight
You like interdimensional psychic vampire pedophiles? Whoa dude,t3_a7lyp3,TheNewRight
"Thanks for stopping by, I the reason for “this board” is cause we can’t express our opinions on politics without being downvotes into oblivion, even if we make our points politely and fairly... so you know, just try to not downvote everything, and welcome",t3_a6t9fd,TheNewRight
How do you get voting rights immediately from social cohension? I like how I am the liar for posting the Compact. 'These animals'... What a piece of trash you are ,t3_a3dtwh,TheNewRight
"Oh, 'I've been warned'? Hahaha! Good luck with that. Please please please 'report' me - we could all benefit from increased scrutiny of what you're doing. ",t3_a5cboz,TheNewRight
Look up Weimar Germany friend.,t3_a6t9fd,TheNewRight
[deleted],t3_a5cboz,TheNewRight
This is what you are left with when you declare the media as 'fake news'.,t3_aa666q,TheNewRight
They are throwing it away ,t3_a7x3cc,TheNewRight
Lmfao it's like you put a fake moustache on a mirror and then described the enemy you saw in it ,t3_a5x6ct,TheNewRight
This is grandma Facebook tier stuff.,t3_a2mi6n,TheNewRight
The guy literally spoke at a Trump event. He's not a journalist either those are both facts.,t3_a2nsyj,TheNewRight
"That song is indeed rapey! 'Ah, you're very pushy you know? I like to think of it as opportunistic I simply must go (Baby it's cold outside) The answer is no (But baby it's cold outside)' I suppose if you only get laid by begging and pestering you would be opposed to ghay song being called rapey.",t3_a2n2c3,TheNewRight
"'But when the political lens shifts from partisanship to ideology, the participation gap vanishes. Self-described political conservatives were no more likely than liberals or moderates to have received food stamps (17% for each group), according to the survey.' Or maybe Republicans don't admit or understand what Governemnt Assistance is Just ask Craig T. Nelson, TV's 'Coach'",t3_a2tp9e,TheNewRight
"His people are perplexing, I can’t wait to read the psychological studies on them in the years to come. ",t3_a0v6vt,TheNewRight
"I definitely did, it’s gross.. these people are a cancer! they’re mostly sexist, incels and racist. If not, they’re usually just stupid. I used to look through T_D post, but it’s just too much disgustingness. ",t3_a0v6vt,TheNewRight
The group crying about Republicans being censored calling for censorship? What typical hypocrites. ,t3_a35kan,TheNewRight
"You can convince yourself that your racism is ok, but it's not. Somehow your ignorant comments embarrass a one balled cheater.",t3_a97zl2,TheNewRight
"I’m not entirely sure you understand how this country works. Says the Marxist who, not even half a dozen posts ago, said that 'hate speech' isn't covered by the 1st Amendment. The rule never isn't true. SJWs always project.",t3_a5oryu,TheNewRight
Then why is it all conservative subs that ban people here,t3_a68l41,TheNewRight
No just a very very specific set of ppl i don't like are nazis. Specifically the ones trying to ban almost all brown ppl from the west based on Charles Murray's race iq bullshit and PJW blood and soil videos (that have been debunked to death). Also calling out ppl for wanting to purge brown ppl from the west isn't racist you idiot. The opposite infact.,t3_a3n3h7,TheNewRight
"I doubt they are mentally handicapped, and that angsty video would never have been made if they had not been murdered. It's easy to just blaim someone different from you.",t3_a97zl2,TheNewRight
"Oh no no no. I was trying to point out how ancient your idea is. I am all for a persons rights. You seem to want to tie a persons rights to their monetary value. Like if a man works hard his whole life but falls on hard times and loses everything, he's less of a man and doesn't deserve any say in the political process. I simply disagree with that notion.",t3_a7mgy3,TheNewRight
A safe haven for Nazis. The 'safe haven' is being created for Patreon. To keep you safe from 'Nazis'. They are what make you feel unsafe lol,t3_a77fb5,TheNewRight
Yeah illegals,t3_a5353g,TheNewRight
'Your refusal to admit that you're a misogynist proves that you're a misogynist.' My x-gf with Borderline Personality Disorder and severe daddy issues said exactly the same thing.,t3_a9hkwh,TheNewRight
'I don't know what communism is',t3_a2ne07,TheNewRight
RT,t3_a9hkwh,TheNewRight
Ppl get to call you a racist and you don't get to complain. / Not to mention they work way harder than you. Hence the net surplus to our economy.,t3_a5353g,TheNewRight
"Democrat? That’s not an argument. Why do you risk being ridiculed by putting labels on people you don’t know? That’s such poor rhetorics... If you are not with us, you are with the terrorist globalist democrat liberals. So here it is: I can’t be a Democrat since I am French. Also, I couldn’t be a Communist (although you don’t know what communism is so in your head I understand I might be). How can you be 'French' if you don't even know what the fuck is going on in your own country. I think you are full of shit because I just proved you are, therefore anything you claim is not worthy of believing. I think you are a paid ShareBlue or CTR shill trying to 'correct the record' for your bullshit godless criminal refuted and archaic 'ideology'. Thanks for the lecture on my own country and the events in the city I live in. However, I now understand that you don’t care about dialogue or truth. And I am the king of England and have a 3 foot long cock. You copy paste links as if they could ever replace an original though but the sad truth is that these tactics are only good for gaining a little bit of attention. So I just won’t give my attention to you. You've been proven wrong on all points of your attempted shill attack, all your slander and whining won't change that. Deal with it communist. Au revoir petit inculte mal dans sa peau. Demande à Google ce que ça veut dire si jamais ton cerveau atrophié est encore capable de résoudre un problème simple sans avoir besoin de demander de l’aide à un blog conservateur. Va te faire foutre toi dégoûtant morceau de merde shill communiste ",t3_a4usav,TheNewRight
"The problem with this is that many of the programs paid for by taxes are given to people who cannot afford to pay them. Nobody is going to pay for social security when they are young if they have a choice, and it completely defeats the purpose if you have only older people paying for it, because they are supposed to be the ones that benefit from it. Choosing where your taxes go sounds like a cool idea at first, but it could never actually work.",t3_a7x3cc,TheNewRight
It wasn't a Democratic president who invaded Afghanistan. No it was a Neocon. Then another (half black) Neocon continued it for 8 years. ,t3_a89y6w,TheNewRight
There’s no federal sales tax.,t3_a7mgy3,TheNewRight
It’s good to point out that this is one of their tactics tho ,t3_a9hkwh,TheNewRight
"This. If you have dry turkey, you fucked up. Brine it, or deep fry it, or best: spatchcock. Or spatchcock a brined turkey, haven’t tried that one. But if you just bake it like all the thanksgiving pictures, you’re gonna have dry breasts. Nobody likes dry breasts. Glistening, juicy, plump breasts are best. Wait, sorry, I stopped thinking about turkey for a second, but the advice still stands.",t3_a8behi,TheNewRight
"And that was an even worse try. Free tip, you talking piece of hobo shit, you can't say there is no God, then whine about how hating the immoral isn't 'Christian' immediately afterwards(even though it is, those who do not hate evil are aiding evil). Even for a leftist, you're a special kind of stupid.",t3_a48d9l,TheNewRight
Nothing says classy quite like using someone's murder to press your agenda. Bonus points for insulting a dead woman's anti prejudiced posts.,t3_a97zl2,TheNewRight
"The dude is an antisemitie, doesn't believe in global warming but believes insulting his god is fighting words. The dudes a complete idiot it's pretty obvious. ",t3_a37op1,TheNewRight
This isn’t fake news. It is being reported everywhere.  More fake news? ,t3_a8ddql,TheNewRight
I'm so glad I don't live inside your head? I hope you can get the help you need and come back to reality. ,t3_a6dgc9,TheNewRight
Go buy a ham and contribute to the dinner?,t3_a8behi,TheNewRight
I will be messaging you on  |-|-|-|-|-|-|,t3_a8onny,TheNewRight
#yeet,t3_a7lyp3,TheNewRight
"This is just heartbreaking and sickening beyond all reason. Who in their right mind would do this, especially to a 4 year old child. If there is a hell, then I hope there is a special torturous place for them to go.",t3_a7ptv8,TheNewRight
Still peddling the uranium one conspiracy BS lol ,t3_a34rv7,TheNewRight
Tell that to the Russian agent in the White House comrade. ,t3_a8d57t,TheNewRight
" How many of the names there are going to jail and or now cooperating with Mueller? Stayed tuned, more indictments coming sweetie ",t3_a2vu47,TheNewRight
"I think we’re at 40+ indictments, 6 convictions so far, and $50M in fines?",t3_a5x6ct,TheNewRight
"I will say, I agree with the sentiment that the Clintons are dirty. I don't have a smoking gun but I get what people are saying when they are pointing fingers. What I don't get is, a republican president, a republican senate, and all the willpower of the republicans aimed at bringing her down.....where's the actual charges? All I see are these propoganda hit pieces saying things like 'DIRTY CLINTONS EXPOSED'.....mother fucker, tell your boy to put her in prison then! If she's guilty, she should go to jail. So far I have yet to see actual, real world charges brought up against her.....unless the Republicans are owned by SOROS!!!!!",t3_a5x6ct,TheNewRight
Here's the story from a less biased source. ,t3_a3dtwh,TheNewRight
O brought up how.you guys worship a fat blob? Yup yes I did glad you agree you do. ,t3_a32izq,TheNewRight
"The one where I don't get offended regardless of whether someone says  &#x200B; Please note, that I'm not assuming you get offended by any of these things, I'm just making a point about how hypocritical it is for the 'SJW ARE EVIL' crowd, which tends to be conservative, to act like everyone else is offended and they are the only adults in the room. &#x200B;",t3_a3dquw,TheNewRight
Help support his channel so he can afford buttons.,t3_a8zkca,TheNewRight
THAT'S THE FUCKING LIE!!! Look at the actual CIS study!! It's 63%.  63% of Non-Citizen Households Access Welfare Programs Compared to 35% of native households So...yea...fuck shitty sources who make number up!!! ,t3_a5353g,TheNewRight
"What recourse is there against the judge, social worker, attorney and Blake Foundation employee.? They’re all obviously guilty of allowing this to happen, but how do you go about using the justice system to make sure they pay for their crimes?",t3_a7ptv8,TheNewRight
The reason republicans keep yelling “perjury trap” is bc ken starr is on the record literally trying to do that to clinton. If you get a chance listen to the Slow Burn podcast on the whole thing,t3_a5x6ct,TheNewRight
,t3_a3cbfd,TheNewRight
"Destroying? It's not the only measure of how well a place is doing, but last i checked Colorado's unemployment rate was 2.8%. Wasn't it like 8% 10 years ago?",t3_a3dquw,TheNewRight
This was why the Berlin wall came down: the Communists won the Cold War by changing their form so they could infiltrate Western governments and achieve a soft revolution. They're already in charge. ,t3_aaf6c5,TheNewRight
How raw and earthy. ,t3_a915dq,TheNewRight
"But that link is full of facts, and doesn't let all 'phobes' spit hate and lies.",t3_a3dtwh,TheNewRight
">You're reading comprehension makes that hard to believe, but I'm game. Disagreement doesn't mean stupidity >Who is your favorite author and what is the last book you read? Listened to a few books on tape since then but it's a toss up between a knights own book of chivalry written by Geoffroy de charney and sun tzus art of War. Having a wife and kids cuts into free reading time ",t3_a9hkwh,TheNewRight
"I don't really understand that racial stereotype all that much. Spicy food tolerance and enjoyment seems to be kind of spread relatively evenly across the board from my experience. Although, I gotta admit, it's pretty funny: ",t3_a8behi,TheNewRight
What are you blabbing about? Are you on drugs? Successful career isn’t always synonymous with income. I didn’t mention income at all. ,t3_a1ypmf,TheNewRight
Flynn is a traitor. ,t3_a7f4oh,TheNewRight
One stupid cop is all it takes to send the NPC's scurrying after a fake conspiracy. Disgonbegud. ,t3_abazuq,TheNewRight
'literally bullying'? They're not high-school girls you cornflake,t3_a2ne07,TheNewRight
,t3_aabow8,TheNewRight
There is no way that tiny little rope would hold me.,t3_a3cbfd,TheNewRight
And yet...,t3_a8behi,TheNewRight
"I am not redefing anything, just stating the obvious that is clear to see if your bigoted head wasn't wedged so firmly up your ass you can see what you are for dinner last night. 'Then they should try acting like people. But they can't. And we both know why.' I don't know, tell me. Edit: spelling",t3_a3dtwh,TheNewRight
"The truth gets a tremendous amount of downvotes on this sub, it certainly explains why I am so unpopular ",t3_a8ttd5,TheNewRight
"I don’t know about you, but it would almost be merciful if the planet was nuked and we started from scratch.",t3_a6t9fd,TheNewRight
Congratulations you have a spelling mistake. You're a special snowflake ,t3_a9hkwh,TheNewRight
"SNL hit another homer Saturday and Trump can't stop rage tweeting, it's hilarious how thin skinned he is. ",t3_a6zzwo,TheNewRight
I can agree with that.,t3_a7blx7,TheNewRight
"I am glad he says Mexicans over and over again. Since NAFTA the rate of Mexicans immigrating into the US has declined dramatically and has continues to do so. Most Spanish speakin immigrants are coming from Central America, but now with Trump pulling out of NAFTA, expect more Mexicans.",t3_a7wfcu,TheNewRight
There's a sucker born every day.,t3_aacfg5,TheNewRight
so off-topic then?,t3_a3dtwh,TheNewRight
"Literally in the next sentence (you conveniently left out) from the article that quote is from: But beautiful women are only a part of it. Because here's the thing about Epstein: As some collect butterflies, he collects beautiful minds. 'I invest in people -- be it politics or science. It's what I do,' he has said to friends. And his latest prize addition is the former president. In his eyes, Clinton as a species represents the highest evolutionary form of the political animal. Personally, it sounds to me like Trump was letting the world know that the dude was a pedo without making it too obvious.",t3_a7lyp3,TheNewRight
"I’ll take childless as a compliment. You have no idea about my successful career, my future, or my politics. I’ve just stated I’m against racism and gave you statistics. If you associate that with politics and post shit like this you’re the one with issues.",t3_a1ypmf,TheNewRight
A political ideology expressed only in memes isn’t a political ideology. It’s fucking stupid and good for nobody. ,t3_aa50al,TheNewRight
"Also, let's give credit where credit is due. The Clinton's made the DNC sexy for the wealthy. The amount of country clubs they visited was historic. ",t3_a2f6v8,TheNewRight
"You mean most of your strategy isn't blaming immigrants for everyone's problems? Most of you support Trump's muslim ban so it's not hard too see most of the right's strategy is blood and soil populism. Mostly bc when republicans see videos or hear news of brown ppl suffering bc of their policies they think they're getting one over on assholes. Also don't pretend its just about illegal immigration when you're sending ERO ICE after perfectly legal asylum seekers and supporting a muslim ban. And the near unanimous support you ppl have for obvious racists like Charles Murray, PJW and Stefan Molyneux, all of who advocate keeping brown ppl out of the west no matter what they've done or their circumstances.",t3_a3n3h7,TheNewRight
"Wow, that guy needs his meds adjusted... &#x200B;",t3_a6uc8x,TheNewRight
Lol you forgot how to be an American,t3_a5oryu,TheNewRight
"I am aware it happened and I am admonishing you for trying to politically capitalize on murder. Remember, the majority of terrorists attacks in the US in the past 15 years were committed by white men. So if you want to profile, lock yourself away.",t3_a97zl2,TheNewRight
*Former*? Who the fuck cares what former employees think?,t3_a6p9q4,TheNewRight
Even Trump didn't want a wall  But unsurprisingly you are spreading more lies. ,t3_aapmf7,TheNewRight
Israel First!,t3_a2u2od,TheNewRight
"Uh, care to elaborate on how they are paying?",t3_a6ev6x,TheNewRight
"Ok... so because it was started by a veteran that means that somehow the wall is going to shelter and feed homeless veterans, take care of the families that lost their husbands/fathers, and take care of the psychological needs of soldiers that returned mentally scared? That amount of money could have done some real good but instead you gave it to a huckster that's only going to build two things... jack and shit.",t3_a8ejrx,TheNewRight
ugh,t3_a8ttd5,TheNewRight
"It's almost like California knows those undocumented ppl contribute a net plus to the economy. And that if you racist idiots got your way then they wouldn't be able to meet marginal productivity because of lack of labor in certain industries, so they'd lose money. That's the opposite of parasitism you fucking idiot. Not to mention most of the welfare they receive is food stamps, which is DEFICIT NEUTRAL. Also Kansas is what you get when conservatives are allowed to make all the policy decisions. And those medicaid receipts would probably go down if they were given labor law protections and could make above minimum wage.",t3_a5353g,TheNewRight
It's always good to see a judge following the clear intent and the letter of the law as written by Congress.,t3_a7z2v9,TheNewRight
slow news day?,t3_a8kp4h,TheNewRight
Just because you don't understand something doesn't mean it's scary and bad.,t3_a0ym3t,TheNewRight
"Plus the people that plead guilty. I don’t know why they would do that if they were innocent. I know I wouldn’t. Corsi also admitted he lied to the FBI, so we’ll see how that goes. Also, a devout Christian doesn’t qualify someone as having high moral grounds. Often times it could be considered a negative quality. ",t3_a2vu47,TheNewRight
"Socialism and national socialism are two different things. While National Socialism is considered a branch of socialism, the Nazi's actually hated socialism and communism with a burning passion. The name 'National Socialism' was purposefully misleading. The word 'Socialism' in 'National Socialism' was used to get votes from the working class people. ",t3_a7blx7,TheNewRight
15 years is 15 years. Do you not understand math either?,t3_a9npf3,TheNewRight
Poe's Law at work. These people are so out there that it's impossible to tell whether such works are parody or not. I'd also like to point out that the left claims that *we* are the anti-science/scientifically illiterate ones. ,t3_a9np2d,TheNewRight
"Anytime someone says 'The answer is No' and the pestering continues, it's not love. If that was falling in love he would have driven her home.",t3_a2n2c3,TheNewRight
[deleted],t3_a8behi,TheNewRight
Diversity = eliminating white people ,t3_a85ypz,TheNewRight
"How do you get voting rights immediately from From the words 'full inclusion'? If you think that doesn't involve giving those animals citizenship, then you're either lying or mentally deficient. >'These animals'... That's what you call an ungrateful creature that sleeps in it's own shit and rapes whatever it sees. An animal. ",t3_a3dtwh,TheNewRight
May want to ask Michael Cohen and Paul Manafort about that. Jr too. And Michael Flynn. ,t3_a48d9l,TheNewRight
"Says the President of Brazil, who then finger gunned.",t3_a838de,TheNewRight
It's absolutely not. ,t3_a3dquw,TheNewRight
,t3_aado9d,TheNewRight
">Democrats are not authoritarian. We’re just done tolerating intolerance. So not authoritarian but you are just so done with that pesky freedom of speech thing and, “we won’t tolerate anything we find intolerant!” So you and who else is deciding what should be tolerated? The irony is so thick I can’t see through it. How about a marketplace of ideas and we disregard stupid ones and promote smart ones and we won’t need a thought police. Who exactly should have the power of this, “non tolerance,” board?",t3_a5oryu,TheNewRight
