body,link_id,subreddit
Yeah as far as things go around here.....I like that idea.,t3_a7x3cc,TheNewRight
The same parents who’re friends with Epstein and Podesta.,t3_a6t9fd,TheNewRight
"Even if that were true (its not, youre delusional) communists are still a bigger threat. ",t3_a2ne07,TheNewRight
"True. But it's more than just islam, these people are products of centuries of islamic culture and religion, and just because they don't practice islam now or they stop being islamic doesn't mean they will stop being degenerate low IQ subhumans.",t3_a5c3ko,TheNewRight
All tax payers paying for it: that’s our solar power plant Pelosi’s brother-in-law: it’s my power plant This is politics,t3_a9od6f,TheNewRight
The lowest tax bracket is 10%.,t3_a9hkwh,TheNewRight
Nazi was a pun made up by German Jewish newspapers to make fun of the NSDAP.,t3_a9b4l0,TheNewRight
Wouldn’t know,t3_a23kal,TheNewRight
Looks like you've got nothing. That's exactly what I thought.,t3_a35auu,TheNewRight
It would be a huge undertaking. And would require people to pay attention. Maybe the default would be government decides and there is an option to divide it manually.,t3_a7x3cc,TheNewRight
 Freaking liberal puke knows nothing ,t3_a7qqx1,TheNewRight
They scream for it because it gives them a weapon to use to destroy the country from the inside and steal the success of the host.,t3_a3n3h7,TheNewRight
[removed],t3_9i518t,TheNewRight
Boer are white. Bantu are not.,t3_a8behi,TheNewRight
[removed],t3_a9ojev,TheNewRight
CA is such a joke,t3_a7qidi,TheNewRight
[removed],t3_aa0hwk,TheNewRight
"You come here spouting some BS fake news. What did you expect? You libtards are so used to the right wingers playing by your rules, fuck your rules. Manners??? You came here proselytizing with BS facts. A real debate would have been impossible to start with. Your comments and post throughout your profile tell me one thing, you are not interested in debate. You are just preaching.. If theres one thing I know, it's how to deal with people like you. ",t3_a2khfd,TheNewRight
[removed],t3_a9qiq2,TheNewRight
Glorious exposition comrade! ,t3_a7blx7,TheNewRight
A frog in a pot... ,t3_a3dquw,TheNewRight
I thought we were exchanging ideas. It's OK to disagree. It doesn't have to be my way or the highway. ,t3_a8kp4h,TheNewRight
"Regardless, the  never goes out of style.",t3_a6p9q4,TheNewRight
[removed],t3_a2nstc,TheNewRight
Proven how? Just because you swallow the assumptions necessary to believe this is true doesn't mean I will agree. I think diversity makes us stronger. New people and new ideas are a source of strength. The Swedes brought the idea of the log cabin that Abraham Lincoln grew up in and now it is as American as can be. The 'American crawl' stroke was unknown to Europeans until a pair of Native-Americans demonstrated a faster way to swim. Basically the entire traditional Thanksgiving feast consists of plants (and the turkey) domesticated here in the New World and adopted as part of our culture. Adopting and mixing together good ideas is a huge part of what makes America great. ,t3_a8kp4h,TheNewRight
[deleted],t3_a77fb5,TheNewRight
He's the last prince left in the galaxy!,t3_a4y8kj,TheNewRight
"It's great that you got an opportunity to get that off your chest. So what you are saying is that the concept of a 'cuck' doesn't hold any metaphorical consistency? That it just another way to call a man weak? Please correct me if I have interpreted that wrong. I'm not trying to put words in your mouth. If I'm right though, then what's the point of using a cuckold metaphor? Are we supposed to be more insulted because you have attached an unrelated insult to your claim that we are feeble? ",t3_a8kp4h,TheNewRight
Ironic,t3_a2ne07,TheNewRight
We meet again. I heard your dad's dick needs sucking. My dad is available . Let me know a good time.,t3_a2qtya,TheNewRight
.....That doesn't matter. Nothing anyone ever says will make this a political issue. ###IT WAS INCITED BY A DEMOCRAT POLITICAL ORGANIZATION SHILL,t3_a3dquw,TheNewRight
"u/el5965  of: >And here's an article of a bunch of actual veterans shitting down his throat for his criticism of a diverse military. &#x200B; I think this is a misunderstanding as to the definition and the extent of diversity. Yes we Americans do have a strength from our diversity, but Tucker IMO was also correct in stating that not able to communicate with your neighbor and not sharing common values is not the kind of diversity that makes our Nation great and/or strong. Diversity in of itself is neither a good thing or a bad thing, think of it like water. We need water to continue to live, but too much water can kill us (**drown** if you are wondering). Not saying too much diversity will kill us, only stating that diversity is an aspect that can contribute to an end result, either positively or negatively. Diversity is not limited to race, culture, or only to human being in general. &#x200B; Diverse: showing a great deal of variety. &#x200B; So a diverse selection of thought would be good for more perspectives, yet a diverse selection of instruments in which I beat you with, would not be.",t3_a2vu47,TheNewRight
"ummmmmm these two things are unrelated, what you said involves the criminal confessing, not the victim, doesn't seem that hard to understand...",t3_a7yiil,TheNewRight
[removed],t3_a20gj8,TheNewRight
You clearly are unable to read.,t3_a2rsgf,TheNewRight
"Yes, and...?",t3_a2mi6n,TheNewRight
We went through the facts you couldn't dispute nor had no rational argument against. Who's living in the fantasy world? ,t3_a0ym3t,TheNewRight
I’ve already explained it but you’re illiterate. ,t3_aaccq5,TheNewRight
"Bruh.... It's spelled ditto. Two consonants between the vowels make a soft 'I' noise. To recap, in your post calling me dumb, you spelled zero words correctly.",t3_a9hkwh,TheNewRight
Were it not for the pesky hash tag... Nobody gets an ultrasound that early on.,t3_a5zk60,TheNewRight
"Awesome painting. Very cool style. I love the style and way you captured not just the identified of the subjects but you painted a lot of intention into their expressions. I may be wrong, but it appears that trump is painted with 'rough strokes' and Kanye with 'soft rounded strokes' - really neat. &#x200B; Critique: Art can be personal, so neither right or wrong, these are my impressions. I can't help but wonder what you were trying to achieve. It puts me off that Kanye is 'serving' trump by lighting his cigarillo(?). I don't think Kanye carries water for anyone, he's a wild character and will likely be on different sides over time. The 'New slaves' over his shoulder is hard to miss, it's his song, but it seems to label him. Trump does not smoke or drink, so anytime I see art where he is doing either, I think, 'oh, this is someone with TDS trying to attack Trump but it's all projection because they don't even know Trump doesn't have those particular bad habits. I bet the artist smokes and so they put it in the image.' More personal interpretation; I don't believe in magical third eye vision, so I see Kanye as having his real eyes closed (ticked) and his magical third eye open (seeing false reality) and thus he is not aware that Trump is not a 'good person'. Trump in this image has no humor, no twinkle in his eye, and he appears to be purely focussed on his superiority over the viewer, and, perhaps, what he can get from me (the viewer). I respect that skill that went into the image, but I don't see either of these men he way you do. &#x200B; NOTE: I have now looked at your history a little, and it appears that you intend the third eye as a positive. I respect that entirely, no offense meant by my interpretation above. Your Ray Charles is especially cool. I also compliment you on posting the image in different places, You should post in in  and see the reaction, probably will get a whole investing range. I see you answered a question about the image thus: 'Trying to make sense of such a baffling relationship. You can view their friendship from many different angles all with opposing beliefs and conclusions you seek. I believe there’s a lot more than what’s on the surface in their strange relationship, there’s some affinity there but also ulterior motives.' Of course you are right, all powerful people get that way by always having ulterior motives. The biggest mistake we can make is thinking that anyone with real power got that power accidentally, or by being the nicest person in the room. Reality doesn't work that way. I think you can see it in Trump and Kanye, there is a really affection there, but I think they both sense that the other is an 'operator'. And both have a history of unpredictability. It makes them an interesting pair. Thanks for sharing. Your art gave me the gift of firing up the gray matter and making me think.",t3_aa0jg1,TheNewRight
"No, I mean Rachel Bolan. ",t3_a2mi6n,TheNewRight
I constantly run into people who are still obsessed with the democratic candidate from 3 years ago.,t3_a0v6vt,TheNewRight
"You are a Libtard troll. You dont get to contol this conversation. Trump could kill all diseases and the left would spin it. Headlines would read, ' TRUMP IS A KILLER'",t3_a36n2e,TheNewRight
[removed],t3_a32asl,TheNewRight
"You are correct, you said everything but the Holocaust denying to me.",t3_aaccq5,TheNewRight
Good on you for realizing you were wrong but where did you get your info from in the first place?,t3_a5353g,TheNewRight
"Diversity is a significant distinction between races. If a HUGE majority of it is a single race, that’s not diverse. Apparently, understanding a simple term is hard for you.",t3_a47r49,TheNewRight
Seconded. ,t3_a3dtwh,TheNewRight
Read the article. If you can.,t3_a287z5,TheNewRight
Straight fire of a response. Made me go 'dayyyuuuum'.,t3_a2ne07,TheNewRight
[removed],t3_a3dquw,TheNewRight
[removed],t3_aba6p2,TheNewRight
[removed],t3_a3cbfd,TheNewRight
">Why would I leave my home because of racists? I'll just fix where I am from, thanks. Damn you are delusional ",t3_a97zl2,TheNewRight
"Google, the most powerful company in the history of the world, which can literally change reality with changes to its search algorithm, has been implicated in newly released documents, of using that power for the political gains of people its employees politically support. Google is much more than a search engine, it is a platform.",t3_a2822p,TheNewRight
[removed],t3_a6t9fd,TheNewRight
"See the problem is, without a reliable source the content is not realiable. Cultist gobble up lies and don't fancy check. People who check multiple sources don't drink poison laced Flavoraid.",t3_a287z5,TheNewRight
He almost appears to be under the influence of something as he is dancing. Grown men waving dollar bills at him. This is obviously child endangerment. I watched him do his routine on you tube. This is sad. He’s a kid for Gods sake. WTF......,t3_a6t9fd,TheNewRight
[deleted],t3_a2nsyj,TheNewRight
Dude's old as balls and eats fast food. Still works circles around Barry and husband.,t3_a32izq,TheNewRight
[removed],t3_a9oh1r,TheNewRight
Sorry I does not give an option to hand out that simple link ... IDK why. Seriously. Thank you.,t3_a46w6s,TheNewRight
"How do you take “we hate pedos” to be pro spacey? They’re clearly calling spacey a pedo, we may be misunderstanding each other",t3_a9exyb,TheNewRight
"You didn't understand my comment at all buddy. I don't know why you mentioned food stamps are deficit neutral cause i never mentioned food stamps or welfare, as a matter of fact i think of they need it they should have it. No idea why you think I'm being racist either. Also no they couldn't take my job, never said anything about jobs either. ",t3_a5353g,TheNewRight
"He's pointing out the hypocrisy of the liberals wanting to go to war against Assad for using weapons on his own people for protesting, but also support Macron using weapons on his own people for protesting.",t3_a4usav,TheNewRight
"I’m not even sure what you’re trying to argue. Renewable energy? That don’t work? Renewable energy will be less expensive than fossil fuels in 2020. That sure seems like they work to me. Go and promote Gab or whatever the fuck place embraces entho-nationalists or whatever Nazis wanna call themselves these days. Build better technology. Build a better user experience. Facebook isn’t even old enough to vote and you’re sitting here crying that it’s an unshakable institution while simultaneously stating that the right-wingers with guns are going to do whatever the fuck it is you think you’re going to do to the liberal population centers across the country. You’re delusional dude, get help. ",t3_a5oryu,TheNewRight
[removed],t3_a5jjvw,TheNewRight
"lol we're not talking about porn, cuckolding is real thing people do and race is often not an aspect of the experience.",t3_a8kp4h,TheNewRight
"They were communists, it's not disputable.",t3_a2ne07,TheNewRight
It honestly makes me sad more than anything. That kid is definitely having horrible stuff done to him behind the scenes ,t3_a6t9fd,TheNewRight
"Just so you know Darth, this sub is absolutely infested with share blue and CTR left wing trolls, just like r/libertarian is. Your downvotes are not coming from the right wing here. The moderators here are asleep at the wheel and I have been banned while these trolls have been here for 3 fucking years!",t3_a0v6vt,TheNewRight
,t3_a38bg7,TheNewRight
"Oh silly troll, that's a bald faced lie, along with pretty much everything you post.  Fact check.",t3_a287z5,TheNewRight
"I have place PancakesAndAss on a 14 day time out, and I will be locking this thread since there shouldn't be much need for further discussion of this post's topic. If they return in 14 days, we can reassess.",t3_a3feyw,TheNewRight
"I sincerely would like to see the evidence that Harvard isn't building a diverse group of students. That includes blue blood conservatives and gloabalists etc. They let in some loud mouth activists. They let in some creative types that only got A's in art and music. They let in some kids who's best line on their CV is they are bilingual or travel a lot. And of course kids with no money that scored perfect on the PSAT get full financial aid sometimes. My point is qualifications aren't always big numbers and anyone with any sense of fairness have to see that starting a political movement, even if you think it is mis guided, and showing success at public speaking deserve a chance at a great education just like, someone who has already shown success in calculus by the time they are 17.",t3_a8onny,TheNewRight
Smarter then I. /s,t3_a8onny,TheNewRight
"Says the person who has posted no sources, and continues to just talk angrily out of his ass.",t3_a2ne07,TheNewRight
I want to know if these people want to ban rap. They probably don't' and I would love to hear them explain why. ,t3_a23kal,TheNewRight
"The truth is that our media, schools, financial institutions lie to us so much we can't believe anything they say, but we need to be stewards of our environment and of the animals in it. It doesn't require the belief in global warming.",t3_a1qox6,TheNewRight
"I love when some pious über person leftist keeps telling other people that they are sinners and must repent. What is unacceptable to 'believe' when talking about science, of all things which is based not on belief but on empirical deduction. Oh wait, wrong religion. ",t3_a5x6ct,TheNewRight
"Google is your friend. Please use it next time. I’ve read some of your posts, so I understand some of your positions but this type of abuse is real and this is how they do it.   ",t3_a2j81e,TheNewRight
"Racism: the belief that all members of each race possess characteristics or abilities specific to that race, especially so as to distinguish it as inferior or superior to another race or races. I guess what it should say is Racism: the belief that all members of each race possess characteristics or abilities specific to that race, especially so as to distinguish it as inferior or superior to another race or races. (Except white people) is this what you're saying?",t3_a2mi6n,TheNewRight
"Yes, the left wingers rioting over climate change legislation The left wingers rioting against the guy who 'stopped far right fascist Le Pen' Left wingers rioting against a guy who vows to 'tackle hate speech' ",t3_a4arx5,TheNewRight
>When you conquered held the earth to secure access to spices,t3_a8behi,TheNewRight
"The lowest tax bracket is 10%, a married couple making less than $20,000. Ten percent of that is $2000, which is offset by your dependents(children). ",t3_a9hkwh,TheNewRight
What was it that Obuma said? Elections have consequences. ,t3_a2qpat,TheNewRight
Newsweak...,t3_a50t1m,TheNewRight
"Only thing keeping reddit going is, shear numbers. Leftist are losing in the physical world, so they retreat to the virtual where things are bias in their favor. I can't speak for the mods of the\_donald, but I would cut them some slack. They are bombarded with lemmings / NPCs constantly trying to pollute the domreddit with nonsense to get the subreddit ban, to point a finger and say 'see, they are: racist, fascist, nazis, >insert lame misnomer here>', and/or give themselves something to post about in their safe spaces like: TMoR, AHS, etc.. &#x200B; Take another upvote for your troubles, spunky.",t3_a7f1ig,TheNewRight
\^Purge list. ,t3_a6p9q4,TheNewRight
[deleted],t3_a2u2od,TheNewRight
That I keep posting facts and references and you just keep talking out of your ass?,t3_a2ne07,TheNewRight
Fuck it depends on the democrats? glwt.,t3_a6ev6x,TheNewRight
Lawnmower man?,t3_a7f1ig,TheNewRight
[deleted],t3_a2mwa7,TheNewRight
>Still running into these people al Your right &#x200B; I don't care he is 100X better then that crook hillary ,t3_a0v6vt,TheNewRight
Both. Feeding and housing the homeless is an absolutely wonderful thing to do. I wouldn't be mad.,t3_a7x3cc,TheNewRight
Where?,t3_a7x3cc,TheNewRight
/r/PoliticalHumor is non essential,t3_a8lia1,TheNewRight
"Oh, so you can’t read. I don’t have to tell you the ideal situation for America’s posterity. The Framers and Founding Fathers have extensive writings on the subject. ",t3_a97zl2,TheNewRight
When you die nobody will even notice,t3_a24ldd,TheNewRight
"You haven’t even done a single thing to prove him wrong. Why are you acting like you’re right? How blind are you? What happened to make you so stupid and absent minded? Did your parents hate you? Do you not get enough love, so that you resort to hateful comments on reddit to bring up your ego so you don’t kill yourself? Who hurt you? You are a sad soul, lost in the abyss of hate and despair, devoid of reason or logic; you are giving people fuel to despise you, and all you do is stubbornly stand your ground with no basis and no logic. Why are you like this?",t3_a0v6vt,TheNewRight
[removed],t3_97pgb8,TheNewRight
I'm married with children jackass,t3_a9hkwh,TheNewRight
they don't take a cut. ,t3_a7x3cc,TheNewRight
[deleted],t3_a6t9fd,TheNewRight
,t3_a1xdli,TheNewRight
"Yes, people can be fragile sometimes. Jews in camps were sure 'fragile', 'scared', and fueled by 'fear'. Did focusing on that de legitimize the Jewish holocaust? If not, why does that DE legitimize concerns people of 'white' (ethnic European) ancestry experience? ",t3_aammyy,TheNewRight
[removed],t3_a3dquw,TheNewRight
If the left doesn't wake up and back the fuck down it will escalate into full erasure. That isn't 'fascism' it is removing a cancer from the body and simple self defense.,t3_a3n3h7,TheNewRight
"So, you'll continue evading from posting your own research that I asked for after you claimed to have such irrefutable 'research', and now you strawman me.",t3_a8e8z6,TheNewRight
[removed],t3_a2khfd,TheNewRight
"I've been in a single fight in my life, a few years back That was (ironically) defending a Jewish friend at a movie theater from actual neonazi wannabees who kept using the term 'k-ke' In retrospect I would not have done so if I realized that he (or other 'oppressed people') would look the other way when prejudice is aimed at me, because it's 'totally different' ",t3_aammyy,TheNewRight
Ya...I know there are “tons” of good sound conservative s out on the left coast...just gotta do something about the wacko politicians...(I have family out there BTW),t3_a5oryu,TheNewRight
Lots of bad things happen to a lot of people. That's always been true and always will be. Never gonna change no matter what laws get passed or what songs trigger sjws. Do-gooders have caused more suffering in the world than anything else. ,t3_a2n2c3,TheNewRight
[removed],t3_aa2ogh,TheNewRight
"I'm not whining about the source, just asking for a credible one.",t3_a287z5,TheNewRight
"Millions of illegals... What? Has there ever been a proven case of illegals voting? I can probably find more evidence for entire districts of legal voters being shut out from voting because their skintone is a little too dark than you can find evidence for 'Illegals voting'. (Tip, i know i can because i had this same discussion with my dad weeks ago and he ended up changing the subject to Hillary which is how i know i was right.)",t3_a3dquw,TheNewRight
That's not how welfare works my boi,t3_a5353g,TheNewRight
Just a reminder most of the ppl out there are way too the left of you. Too the left of liberals also.,t3_a4usav,TheNewRight
"Whatsoever a man soweth, that shall he also reap.",t3_a324y0,TheNewRight
[removed],t3_a8behi,TheNewRight
 ,t3_a203p0,TheNewRight
"So yes, it was a post shitting on white people, thanks for agreeing shill Why do i get the feeling your statistic about terror attacks started analysis on '9/12/2001'? Also was this one that considers Cesar Sayoc and Omar Mateen white as snow?",t3_a9npf3,TheNewRight
What the fawk,t3_a32asl,TheNewRight
"No I don't they do the same shit to political dissidents too, look at Paul Manafort or Jerome Corsi, look at tons of other people too, look at the Proud Boys, look at tons and tons of other people too",t3_a203p0,TheNewRight
[deleted],t3_a8o6ja,TheNewRight
"The thesis of this article: When it comes to the Sun’s influence on climate, one conclusion is certain: there is no widespread scientific agreement as to *how* and *to what extent* solar activity and its related parameters (i.e., galactic cosmic rays, geomagnetic activity, solar wind flux) impact changes in the Earth’s temperature and precipitation. In other words, 'we can't draw any responsible conclusions from the research that's been done so far regarding whether the sun is impacting climate change one way or another.' Yet here's OP, cheerfully blasting this all over Reddit as if it's meaningful, the very definition of propaganda. &#x200B;",t3_aa2mae,TheNewRight
"Yeah, someone is using this to not only spread false propaganda but to RIP off idiots who believe it.",t3_a2j81e,TheNewRight
It's tremendously ironic that the left is trying to stop a song about a woman who chooses to defy social norms.,t3_a3dquw,TheNewRight
[deleted],t3_a3cf0q,TheNewRight
"I took the time to read the entire Washington Times article. Its amazing, it was just news. No editorial hit piece. I didnt read anything about lies, just facts. You are an NPC that needs a software update.",t3_a36n2e,TheNewRight
"Cool, I'm taking that as I've won the argument :) ",t3_a3ds7v,TheNewRight
You got it,t3_a6p9q4,TheNewRight
I had to stop when the author was proven stupid in saying France had two miserable losses in the two world wars. They won the first one! How stupid to history is that author.,t3_a4arx5,TheNewRight
[deleted],t3_a5x6ct,TheNewRight
[removed],t3_a68fkl,TheNewRight
'Chemical Macron',t3_a4oor3,TheNewRight
"So basically you’re a Christian fascist. Fascist are on the far left, hence your hatred of Wall Street and big business, as well as Jews. Fascist lefties don’t belong here.",t3_a37op1,TheNewRight
Leader? WTF,t3_a8onny,TheNewRight
"Ad hominem, you are literally fulfilling a meme. But I suppose you have no choice. Kek wills it.",t3_a0v6vt,TheNewRight
"The document that created America, the Declaration of Independence states “We hold these truths to be self-evident, that all men are created equal, that they are endowed by their Creator with certain unalienable Rights, that among these are Life, Liberty and the pursuit of Happiness” The Statue of Liberty, which welcomed thousands upon thousands of immigrants is inscribed with 'Give me your tired, your poor, Your huddled masses yearning to breathe free, The wretched refuse of your teeming shore, Send these, the homeless, tempest-tost to me, I lift my lamp beside the golden door!' Meanwhile, you advocate white supremacy and probably claim the Civil War was about State's rights.",t3_a97zl2,TheNewRight
just  so it will show up in their notifications.,t3_a3feyw,TheNewRight
why are you being offended by this you are not a white man from the 1800s ,t3_a8227s,TheNewRight
[removed],t3_a8onny,TheNewRight
'...and to not even know it' Fixed that for yoy.,t3_a2ne07,TheNewRight
[removed],t3_a8behi,TheNewRight
[removed],t3_a2mi6n,TheNewRight
Gallows is fine.,t3_a3n3h7,TheNewRight
One man..... ? what a man that musta been! ,t3_a8mp3j,TheNewRight
The troll is back in town... ,t3_a2f6v8,TheNewRight
