body,link_id,subreddit
[deleted],t3_a838de,TheNewRight
Must be that dang Soros /s,t3_a8onny,TheNewRight
"No difference? The little child is in a gay club, after hours, and getting money thrown to him on stage. No difference.. Are you out of your mind?",t3_a6t9fd,TheNewRight
I wonder if you people will ever use actual news sources. ,t3_a3zm2c,TheNewRight
"It's 2018, the media tells me only straight white males can be racist so it must be true. Can't wait for what 2019 brings me as a straight white male! It's our turn to take the oppression! /s",t3_a9b4l0,TheNewRight
What's your obsession with Jews? Check yourself before you wreck yourself. ,t3_a77fb5,TheNewRight
"Que the “No shit, Sherlock meme”",t3_a5353g,TheNewRight
Who 'crawls under a fridge'. Worst troll ever.,t3_a32asl,TheNewRight
Not for me to answer. Click is ticking. Terrorist. ,t3_a2sbx3,TheNewRight
Literally no one thinks your post is intelligent Israel is not at war with Egypt and... ,t3_a8e8z6,TheNewRight
Calling polls you don't agree with 'outliers' is dishonest. ,t3_a5jjvw,TheNewRight
Lol... So many gullible meatheads on this sub. This never happened.,t3_a2sbx3,TheNewRight
"Do you not support trans rights? (I'm just kidding, before anyone freaks out)",t3_a6t9fd,TheNewRight
Turkeys aren't even native to the same area where white ppl are from.,t3_a8behi,TheNewRight
[deleted],t3_a9aowy,TheNewRight
"Alaskan here. Can confirm, and that Olympics has some crazy shit in it too. Shit the Japanese wouldn't even think of.",t3_a9b4l0,TheNewRight
'representation without taxation'...I like it...agree with it. These politicians are so in the pockets of the Chamber of Commerce and Big Business it's disgusting.,t3_a7mgy3,TheNewRight
Sad. She’s probably getting paid big bucks to spew this garbage ,t3_a9np2d,TheNewRight
As any who has been exposed to tear gas can tell you liking it to a chemical weapon strike is absurd. It really devalues the brutality of chemical weapons victims. A mild irritant is in no way comparable to a gas that melts your skin as you flop around on the ground because your suffocating while you spasm. Comparing the two is ignorant idiotic arrogance.,t3_a4oor3,TheNewRight
Not susceptible to arbitrary censorship. Susceptible to deliberate kosher censorship. ,t3_a77fb5,TheNewRight
I've always maintained that only net taxpayers should be allowed to vote. Once you're on government assistance you have a conflict of interest to vote yourself more entitlements.,t3_a7mgy3,TheNewRight
What a coward.,t3_a7blx7,TheNewRight
And 1 faggot who only comments in one subreddit 24/7. ,t3_a2nstc,TheNewRight
All but one of the people on McCarthys list was a communist. Communists do not deserve a say in government. ,t3_a2ne07,TheNewRight
Correction: Michelle Obama voluntarily surrendered *his license in 1993,t3_a32asl,TheNewRight
" gen·der/ˈjendər/*noun* 1. 1.the state of being male or female (typically used with reference to social and cultural differences rather than biological ones). sex/seks/*noun* 1. 2.either of the two main categories (male and female) into which humans and many other living things are divided on the basis of their reproductive functions. &#x200B; Note that OP and many others are confusing SEX with GENDER. There are 2 sexes (not even true, but more complicated than is worth discussing here) But GENDER is only tied to sex, and is a spectrum. Gender and sex are not the same. Edit: lol downvoting the definitions of words, you absolute morons.",t3_aba6p2,TheNewRight
She cant cook. Blames an entire race of people. ,t3_a8behi,TheNewRight
"OP is an ignorant, lying, atrotrufing troll.",t3_aaa56l,TheNewRight
"The day isn't far off when leftists will have pushed this country to war. You'd think the side that hates guns and masculinity wouldn't be so belligerently violent, but there you are. At least it'll be easy to mop them up once the cities all starve.",t3_a7uiso,TheNewRight
[deleted],t3_aaf6c5,TheNewRight
OP is fake.,t3_aaa56l,TheNewRight
To keep Americans... in?,t3_a7mgy3,TheNewRight
"The level of mental illness spewing from this woman should be unprecedented. As much as I don’t wish this on any individual, nor on society as a whole, the only reason this level of incompetency is allowed to exist is because of the good times that have been created by strong and intelligent men and women. If it weren’t for the technological advances made in the last couple hundred years, this cunt would be cleaning and cooking whatever the fuck was available. Perhaps earth needs a hard reset to expel the radical ignorance preached from the hard left, particularly radical feminism and transgenderism.",t3_a8behi,TheNewRight
"Man, the French people sure do know how to freedom.",t3_a4usav,TheNewRight
She's also a certified moron. The woman hates people who are named after places yet has a kid named India.,t3_a2sbx3,TheNewRight
"All that welfare money is paid for by Americans for our sick and old. Lazy immigrants from poor socialist countries that have run out of rich people to take money from, see our wealth and want to just come here and take it. How leftists see these migrants for anything other than thieving invaders is ridiculous. ",t3_a5353g,TheNewRight
"The guy who started this is a triple amputee Purple Heart veteran, who has a verified blue checkmark account on Facebook. Donations have already rocketed past 4 million and still going strong...",t3_a7x3cc,TheNewRight
"I'm just saying it wasn't an original thought. He did it to ride the coat tails of someone else. I don't have a lot of hate in me. Quite the opposite. You don't don't know me personally, so please don't make statements as if you do. ",t3_a4kky4,TheNewRight
The same kind of 'parents' that chemically castrate their offspring.,t3_a6t9fd,TheNewRight
Reminds me of the “fun” time when they wanted their people to report anyone who is against their Fueh... leader ,t3_a7blx7,TheNewRight
They guy who has more convictions in 6 months than the whole of both Clinton investigations? Why?,t3_a2ne07,TheNewRight
But then we can't support the troops? Why do you not want to support the troops? You do realize that the troops need our support right? What about our boys in blue? You want to take away the lively hood of the troops and our boys in blue? You Liberals make me sick!,t3_a7x3cc,TheNewRight
"Harvard is like 60% jewish. Jews are actually vastly overrepresented compared to every other race including whites and asians, and a significant majority of the lower end people sneaking in with bad scores are jewish. That's just reality but I guess reality is racist. ",t3_a8onny,TheNewRight
Ross Perot was also a big reason he lost. ,t3_a2f6v8,TheNewRight
[deleted],t3_a23kal,TheNewRight
Quit posting this fake shit..,t3_a2j81e,TheNewRight
Ohhhhh that's right. During the time of the slaves.,t3_a7mgy3,TheNewRight
Just another foreigner shitting on a country that is a White majority country and accepted her in. ,t3_a8behi,TheNewRight
"Its not necessarily the US’s problem. Its a humanity problem from my point of view. Those of us that were fortunate enough to be born in the US are in a good position to help those in need. And if we are honest with ourselves, our government has played a major role in some of the problems that these people are experiencing. Not just these people but people all over the world. ",t3_aavtm4,TheNewRight
"You might think that this is nonsensical or crazy, until you realize that the Democratic party is literally the un-American party. They will always, under every circumstance, take a position contrary to the interests of the real American people.",t3_a9ln5w,TheNewRight
"Yep, he made a few mistakes trusting the damn Dems...never trusted those devils !",t3_aakvi2,TheNewRight
"We don't need the federal government outside the DoD, but the DoD is funded till next dec 2019. I say shut it down permanently. ",t3_a85hoh,TheNewRight
This is just a blatant lie. ,t3_a32asl,TheNewRight
[deleted],t3_a2f6v8,TheNewRight
What the fuck is this globalist bullshit....,t3_aaf6c5,TheNewRight
When wypipo be thinkin mayo be to spicy n sheeit lmaoooo ,t3_a8behi,TheNewRight
I distinctly remember hearing that Mexico would pay for it...,t3_a7x3cc,TheNewRight
"LOL what a stupid cunt. If it's dry, you cooked it wrong, dumbass.",t3_a8behi,TheNewRight
"repeal the 19th amendment, and you can take most of the stupidity out of politics. this isn't about right vs left, it's more about a logical man vs a woman being a woman. ",t3_a9b4l0,TheNewRight
Why don’t you explain how it’s the exact same.,t3_a6t9fd,TheNewRight
"No, I believe that the climate is an important topic. This person, tom fitton, has claimed many things. Climate change isn't real, voter fraud is in abundance, accused Obama of rallying protests for trayvon martin to name a few and all without proof. Hes not credible. This is silly... The president didnt pay hush money, or did he? The president had nothing to do with Russia, or did he? Micheal Cohen is a good lawyer, or is he? Im assuming you get your media staright from his tweets, which I consider to be a strange stance. Excuse me for wanting accurate information, not unfounded biased information.",t3_a5x6ct,TheNewRight
not really...just popped in my feed and ended up reading some of the comments; never seen such concentration of stupidity in a sub before...so I was just curious but hey DT fans never disappoint in this aspect ,t3_a8onny,TheNewRight
Hes not reliable or credible and is heavily biased. What he says should be taken lightly. What he says of Clinton goes the same. ,t3_a5x6ct,TheNewRight
Looks like France has their own Antifi going on. ,t3_a47r49,TheNewRight
Yes. ,t3_a7bklu,TheNewRight
"Only if you are upper class, Trump's tax 'cuts' raised taxes on most of the middle class. 80% of the cuts went to the top 1%. Or if you are working for the federal government.",t3_a9hkwh,TheNewRight
"I can wait, good things come to those who wait. It's Trump and his sycophants who are screaming about the time of the investigation that is already paid for from money seized from Trump's crooked cronies.",t3_aampn1,TheNewRight
"He actually took this idea from another celebrity. Tyler perry went to 2 different Walmart locations and spent $430,000 to pay off all the layaway items. ",t3_a4kky4,TheNewRight
The NSDAP did nothing wrong.,t3_a9b4l0,TheNewRight
Well if you want to keep spreading lies and deceit...says a lot about the right...,t3_a3zm2c,TheNewRight
"For the sake of argument, let's assume your first claim (in your headline) is true. Still, how does spending on Google equal all of the 'is the Russian collusion'?? You realize gobs of money was spent on the priority focus, Facebook, right? Also, you realize that Russians wouldn't spend this money directly - they would give it to groups like the NRA or Super PACs supporting Trump, right? Your headline is false and horribly misleading - and I can't tell if you've done this deliberately or by some fault of yours...",t3_a5cboz,TheNewRight
So no argument. Good job! Try again.,t3_a1n5fc,TheNewRight
,t3_a32asl,TheNewRight
"Wow, troll uses troll sites. Shocking. ",t3_a32asl,TheNewRight
She's the worst. ,t3_a8behi,TheNewRight
Perhaps there's hope after all for France,t3_a2sbx3,TheNewRight
ideally this would happen to everyone in the camp. ,t3_aavtm4,TheNewRight
why is this sub full of retards? asking for a friend,t3_a8onny,TheNewRight
You should be banned for naming and shaming.,t3_a2x2bk,TheNewRight
Equality is not an assault on white people. Uncletch snowflake.,t3_a9oh1r,TheNewRight
continues writing long ass comments that have no logical retorts or sources,t3_a1n5fc,TheNewRight
I heard from a friend in LA last week. She said it has gone to shit in the last ten years. Her apartment's parking lot is now filled with homeless living in tents and shitting in the bushes. She lives in a previously nice part of LA at the base of the Hollywood hills above Franklin St..,t3_a7v0ge,TheNewRight
"This just in, Armenian has a hatred for Turkey. More breaking news at 11.",t3_a8behi,TheNewRight
[deleted],t3_a9b4l0,TheNewRight
" Basically, this is a “It’s Fake News” button. ",t3_a7blx7,TheNewRight
Yeah but your sources are all trash bs...not even real news. It's what scholars would call unreliable sources...,t3_a3zm2c,TheNewRight
You're a fucking goober lmao. Hitler was a nationalist populist socialist. Socialism has absolutely no line of mutual exclusion with nationalist populism,t3_a8zmrj,TheNewRight
"lmao these sources linked in the article are saying the biggest threat against her running for presidency is an embarassing PR stunt. how in the world could we elect somebody that's done a bunch of embarrassing documented recorded shit lol we don't live in a time anymore where small irrelevant sideshow things like this matter. trump does some dumb shit every day and during the campaign and people excused it all. his base bent over backwards to justify all sorts of shit that would've absolutely SUNK obama if he had done them. it's gotta be something huge to sink somebody now after trump lowered the bar. you can choke slam journalists and keep your job. i dont see this PR stunt she pulled hurting any chances (she may or may not have had in the first place) i'm not defending Warren's pettiness or weird fixation on this issue, i'm just saying it's only that. a weird sideshow thing. you're kidding yourself if THIS is a dealbreaker for a politician but simultaneously back trump after everything. ",t3_a3zm2c,TheNewRight
"Conservative *is* non partisan, it's just conservative and views things in terms of preservation of nation and tradition, democrats *are* partisan they are racist and deal exclusively in division.",t3_a5x6ct,TheNewRight
Everyone should be scared that communists have infiltrated the government. They should all be put behind bars for the rest of their pathetic lives,t3_a2ne07,TheNewRight
And they will. You didn’t hear that they will write a fat check though. Read Trump’s book if you would like to know more,t3_a7x3cc,TheNewRight
"It must be hard to be wrong so often, not that has ever stopped you from spreading lies and hate on the internet. ",t3_a8ttd5,TheNewRight
Every prosecutor within 300 miles of this kid are probably terrified of getting firebombed for being a 'nazi' if they even think about doing anything,t3_a6t9fd,TheNewRight
Race and IQ are real are we're basically crippling 3 continents because ignoring that fact is more comfortable,t3_a838de,TheNewRight
That just isn’t true... we need to appeal to minorities and we can appeal to minorities in many ways. Appealing to only whites WILL lead to the death of the GOP,t3_aa2ogh,TheNewRight
That Eskimo is really giving him the cold shoulder.,t3_a9b4l0,TheNewRight
"Bro, look at some of the posts in this subreddit. Like 2 weeks ago there was a thread about how White European Males were *. And inside that thread there were folks talking about deporting black americans back to africa. And don't come at me with that 'democrats used to be racist' shit. Sure, USED TO BE. And republicans used to endorse amnesty for illegal immigrants. The difference is our ideas got better and republican's ideas got shittier.",t3_a5oryu,TheNewRight
It’s been a while since we’ve heard from old chairman pao,t3_aaa56l,TheNewRight
Who is Katie Hopkins google? 'She was a contestant in the third series of The Apprentice in 2007' Oh ok...,t3_a2sbx3,TheNewRight
Sweden ofc signed it. Rip ,t3_a56qap,TheNewRight
Since this is a right wing sub reddit then and those in child beauty pageants are largely right wing we can safely say this isn't an issue that has anything to do with politics then. Downvotes without a single response. So much for not being scared of the truth ,t3_a6t9fd,TheNewRight
They had a bad experience with nazis not too long ago.,t3_a7blx7,TheNewRight
"XX and XY isn’t an oversimplification, it’s reality.",t3_aba6p2,TheNewRight
 That's what I was informed it meant. What do you use the term to mean?,t3_a8kp4h,TheNewRight
>Giving your money away to a scam to troll the libs ,t3_a7x3cc,TheNewRight
"That's the dumbest thing I've read all day. 'How do we stop these elites from stealing our country? Oh just put a price on your ability to vote.' Why not take it a step further. If you're in this tax bracket, you get this many votes. If you're in THIS tax bracket, you get this many votes. You should see how many votes you get in the top brackets. It's great. Just pull up your bootstraps and you can get that many votes too. The people with money would never vote for their own best interests so we should give them more votes!",t3_a7mgy3,TheNewRight
Fake outrage over a comedy show while the Mueller investigation tightens its grip. ,t3_a6zzwo,TheNewRight
"and is bordering a sign of delusion Make sure you speak the English language properly before you try talking shit. It's 'and is bordering on delusion'. Dumbass. Continue not refuting my comment, smooth brain.",t3_a1n5fc,TheNewRight
Go ahead. I dare you. Conservative pedophiles like Spacey need to be exposed. ,t3_aa0hwk,TheNewRight
You’re not to smart are you? Barry Obama has never worried about money. Especially not the American people’s money. They stripped his licenses for lying and hers for potential fraud. So get over it. They are both crooks,t3_a32asl,TheNewRight
Have you read what people post on this sub? It only further enforces that article.,t3_a3cbfd,TheNewRight
Seriously. I don't understand how the more militant wing of Trump's base is so nieve but at the same time so skeptical ,t3_a7x3cc,TheNewRight
You put the word “proof” in quotes as though I used it. All I did was provide a link to an article.,t3_a32asl,TheNewRight
[deleted],t3_a85ypz,TheNewRight
Here’s an example I can relate too. The Obama’s surrendered their licenses so they wouldn’t have to keep paying licensing fees and participate in ongoing education fees. I used to be an electrician and advanced into a different field. So why the fuck would I keep paying fees to renew my license and keep up to date on codes/ purchase new code books. ,t3_a32asl,TheNewRight
"This is a CRIME!! DEPORT ILLEGALS = SAVE $$$, OUR TAX $$$ ",t3_a5353g,TheNewRight
">Intellectual Dark Web They'll ban someone within 24 hours of it launching, and odds are it will involve Israel or jews in some way.",t3_a77fb5,TheNewRight
Says the goon. ,t3_a6uc8x,TheNewRight
Our ancestors would beat us if they saw how we have allowed the erosion of American values and common decency. And at the hands of Marxists no less.,t3_a23kal,TheNewRight
Other than the entire republican party?,t3_a85ypz,TheNewRight
Can you show me a picture of this throne he sits on? Not liking political choices is not the same as being a king. It's not how government works.,t3_a4usav,TheNewRight
"'be the change you want to see in the world.' The people donating don't care if they never reach the goal, they are doing what they think is right, no matter what. That is admirable, no matter the reason. ",t3_a7x3cc,TheNewRight
"Small correction. She was born in West Germany, but her father defected to East Germany because he was a communist. Angela Merkel then went on to work in the student's communist propaganda outlet.",t3_aaf6c5,TheNewRight
They removed part of the test again. It’s back to out of 1600. So that 1270. corresponds to a 1900 on your test. 1680 would be closer to 1120 now. 1270 isn’t bad but it’s not Harvard level I agree.,t3_a8onny,TheNewRight
We seriously can’t get the wall soon enough. The wall would save us so much money. We also desperately need to slow down or stop drugs coming in through the border. How many Americans have to die from overdoses before we find ways to keep the drugs out? Too many people I knew are now dead because of liberals and their pro illegal drugs stance. ,t3_a6ev6x,TheNewRight
Omfg...,t3_a5oryu,TheNewRight
"I have nothing to learn looking up whatever it is you’re trying to prove. If you want me to learn, teach me. If you can’t prove your claim, I won’t listen. When you argue with someone and make claims like you did, you have to be ready to back it up because people are going to want proof. It might be different on r/politics, but everywhere else you need evidence to prove your claim. If you don’t have a source or proof, you’re immediately discredited. ",t3_a6zzwo,TheNewRight
"People have long complained of France losing its soul by becoming a secularized, progressive, socialist welfare state shortly after two miserable losses in the two world wars. After being known for its fine arts, beautiful landscapes, rich Catholic tradition, genius philosophers and scientists, and famous monuments, people now see France as a stagnant irrelevant pool of decadence (this descent is captured well in Thomas Merton’s description of the country in *Seven Storey Mountain*). As a result of losing its soul, France has also been losing its body—its people, communities, business, and infrastructure. Like the rest of the , an agreement that would undermine participating countries’ efforts to regulate migration. ",t3_a4arx5,TheNewRight
Your ignorance is palpable.,t3_a3dquw,TheNewRight
"Gaslight,obstruct,Projection. GOP are shameless and factless.",t3_a5x6ct,TheNewRight
"Excuse me? He is a veteran and a devout christian, cite your 'lie' source you piece of shit communist trash. You filthy motherfuckers go through life accusing everyone nonstop without taking any responsibility for your own iniquity. This fucking bullshit 'investigation' on nothing more than accusation has gone on for almost **three fucking years** and has turned up absolutely nothing but some idiot Russian trolls on Facebook or some shit. Almost an entire presidential term now with this bullshit holding thee country back from it's elected leader and costing us millions just because your obsolete and criminal ideology has been rejected.",t3_a2vu47,TheNewRight
Cause that only addresses the war/violence part. It doesn’t address the poverty issue Marie Antoinette. ,t3_aavtm4,TheNewRight
True story though. No one was more surprised (and pissed off) than me. Mace isn't enough to stop a person. ,t3_a4oor3,TheNewRight
"I am not a fan of child beauty pageants and feel that they are also a form of abuse, but there are some obvious differences here. Namely the venue and the purpose of that venue.",t3_a6t9fd,TheNewRight
"nothing will be done about it, mueller is doing the bidding of the establishment, laws do not apply to them. ",t3_a6esjo,TheNewRight
Presidents don't sit on thrones.,t3_a4usav,TheNewRight
It’s all so stupid.,t3_a3dquw,TheNewRight
"Yeah sure, then we can point out how meeting a Russian and rejecting them isn't a crime, and ask why Loretta Lynch personally greenlit their entry into the country, AND why the so called 'FSB agents' personally met with DNC employees immediately before and after the meeting. Please, by all means, have Horseface call him in to testify. Fucking do it, liberal dog.",t3_a48d9l,TheNewRight
Good troll. ,t3_a32asl,TheNewRight
Isnt this child sexual abuse...so NY has no laws then...or do they make them up as they see fit?,t3_a6t9fd,TheNewRight
"I thought Harvard was in favor of “the gentleman’s C”, which for those of you who don’t know, means that you can never really fail a class, they will just give you a C as long as you show up.",t3_a8onny,TheNewRight
Cool story bro. The OP said they surrendered their licenses to not be charged. The link says 'they were not charged'. You don't even read the fake shit you post. Are you a Chinese bot?,t3_a32asl,TheNewRight
Those people don't sound very smart,t3_a9b4l0,TheNewRight
"The Abrahamic God is a rapist. And a genocidaire. And probably a few other things. Get over it, fundies",t3_a42qst,TheNewRight
[deleted],t3_aaf6c5,TheNewRight
Shocking coming from Cucked Colorado ,t3_a3dquw,TheNewRight
I agree. Farmers are welfare queens and for too long they’ve been allowed to vote for their own interests ,t3_a7mgy3,TheNewRight
Be gone with your logic and reason nerd. This is a propaganda sub,t3_a5cboz,TheNewRight
Your post is not grounded in reality and is bordering a sign of delusion.,t3_a1n5fc,TheNewRight
California is the worlds 6th largest economy and one of the richest and most capitalist places on earth. ,t3_a5oryu,TheNewRight
...for what crime?,t3_a2ne07,TheNewRight
Why is it that all these 'GOTCHA!' articles are on websites with ads like 'Crazy Move' Seduces 93.1% Of Women (Psychologists Shocked)'?,t3_a64zb9,TheNewRight
Video full of lies. ,t3_a2nsyj,TheNewRight
"I'm a leftist following this sub - and I appreciate that a few people are brave enough to call out this sort of despicable racism - although some were down voted heavily. Next, I hope you good folks will start to wonder why you seem to attract so much of this white supremacist garbage (like flies to poo...)",t3_a7bklu,TheNewRight
"Harvard has to pay some sort of price for this by way of diminishing reputation. I've already heard students (from Harvard or related Leagues) telling me how, realistically, almost any average student could say they 'Studied at Harvard'. We think that sounds amazing but in 2018 it could mean they took a 'basket weaving' in a Harvard(Tm) extension or whatever. And then we learned they were race-gaming and inducting people based on the color of their skin. That one Indian guy who made it clear he wasn't anywhere near the levels that *would* be required.. except.. he was brown enough. Now this. And what has to happen, what naturally does happen, inevitably, when people show Harvard diplomas they look lighter, fruitier, less special and maybe even 'suspect' at some point. Not that Harvard is the only one doing this but with fame comes responsibility and they are blowing it on stupid SJW gimmicks.",t3_a8onny,TheNewRight
Factcheck.org was created to make lies seem credible.,t3_a32asl,TheNewRight
[deleted],t3_a5oryu,TheNewRight
